id	speaker	time	turn-index	utterance	annotations
iri698	U		18	five years oldf	
iri699	S		19	then after that it is safe.	X,X,O,O,O,T,O,X,T,X, X,T,X,X,O,O,O,O,X,T,O,O,X,X,X,X,X,O,O,O, 
iri700	U		0	hi alex	
iri701	S		1	i will kill him!	X,O,O,X,X,X,X,X,O,X,T,X,X,X,X,X,X,X,X,O,O,T,O,T,O,O,O, X,O,X, 
iri702	U		2	why????	
iri703	S		3	this town is everything a man could ask for.	O,T,O,O,X,X,X,X,O,O,O,T,T,T,T,T,T,O,O,O,O,T,O,O,O,O,O, O,O,O, 
iri704	U		4	so, i do not think that is a good reason for killing!	
iri705	S		5	there is a good reason for that!	X,O,O,O,X,T,T,T,O,O,X,X,O,X,X,X,T,O,O,O,O,T,O,O,O,O,T, O,T,O, 
iri706	U		6	can you explain?	
iri707	S		7	explain what?	T,T,X,O,T,O,O,O,T,T,O,X,X,O,O,O,T,O,O,O,T,O,T,T,O,T,X, T,T,O, 
iri708	U		8	the reason for killing!	
iri709	S		9	you sure that is the reason?	X,T,O,O,X,X,X,X,O,X,X,X,X,X,X,X,T,O,O,O,O,T,O,X,O,O,X, T,X,O, 
iri710	U		10	hey, are you fooling me?	
iri711	S		11	 wouldhildegarde johnson, will you have this man as your wedded husband...	X,T,X,X,X,T,X,X,X,X,T,T,T,X,X,X,T,X,X,O,O,T,T,X,O,O,X, X,X,O, 
iri712	U		12	i think you are delusional!	
iri713	S		13	my client proposes a thirty day cooling off period.	X,X,O,O,X,X,X,X,O,X,T,T,T,X,X,X,O,O,O,O,O,T,O,X,O,O,X, O,X,O, 
iri714	U		14	is that a sort of vacation?	
iri715	S		15	danny ca not take a vacation. can he?	T,T,T,X,T,O,O,O,X,X,T,T,X,O,X,O,T,T,X,X,O,T,O,T,T,X,X, T,X,X, 
iri716	U		16	of course he can! vacations are the best!	
iri717	S		17	of course!	X,T,O,O,X,X,X,X,O,T,O,T,O,X,X,X,X,O,O,X,O,T,O,X,O,X,X, T,X,T, 
iri718	U		18	where did you go for your last vacation?	
iri719	S		19	where did they go?	X,X,O,O,X,X,X,X,O,O,T,T,T,X,X,X,T,O,O,X,O,T,O,X,O,X,T, X,X,X, 
iri720	U		0	hi	
iri721	S		1	you three have a good weekend.	'O','O','O','O','O','O','O','X','T','O', 'O','T','X','O','T','O','O','T','O','O','O','O','O','O','T','O','T','O','O','O', 
iri722	U		2	the weekend has been good. thank you !	'X','O','T','O','O','X','O','T','O','O', 'O','T','O','T','X','O','O','T','T','T','O','O','O','O','X','X','X','X','O','O', 
iri723	S		3	yeah...	'X','O','O','O','O','X','O','T','X','O', 'X','T','X','T','X','X','T','O','T','T','X','T','X','T','T','T','T','T','O','T', 
iri724	U		4	how are you today ?	'T','O','T','X','X','X','O','T','X','O', 'X','X','X','O','T','X','O','T','X','T','O','T','X','X','X','T','X','T','T','O', 
iri725	S		5	i am all right, i suppose. and mom is not too bad. but laura... i dunno.	'X','O','T','O','O','X','O','T','T','O', 'O','X','X','T','O','T','O','T','X','O','T','T','T','T','X','T','X','T','T','O', 
iri726	U		6	who is laura ?	'T','O','T','O','O','X','X','X','T','O', 'X','X','X','O','X','X','X','T','X','X','X','X','T','T','X','T','X','X','X','X', 
iri727	S		7	well... why are you asking this, by the way?	'T','O','T','T','O','X','O','T','X','O', 'X','X','T','O','O','T','O','O','X','O','T','X','T','O','X','X','X','X','O','O', 
iri728	U		8	i am just curious about laura. is that a problem ?	'X','O','X','O','T','T','O','X','O','O', 'O','T','O','O','O','X','O','O','X','O','O','X','O','O','T','X','T','X','O','T', 
iri729	S		9	yeah,.well it is none of your business.	'X','O','T','O','O','T','X','T','T','O', 'X','T','T','T','X','X','O','O','X','O','T','X','T','T','T','O','X','T','T','X', 
iri730	U		10	you are not very friendly !	'X','O','T','X','O','X','X','T','T','O', 'X','T','X','O','T','X','O','O','X','T','X','X','T','O','T','O','T','T','X','X', 
iri731	S		11	do not you believe it.	T,T,O,O,O,O,O,T,T,O,T,O, T,O,T,O,O,O,O,O,O,O,O,T,O,X,O,O,X,O, 
iri732	U		12	you seem a bit upset.	
iri733	S		13	i am not upset!	X,T,T,O,T,X,T,X,O,X,T,X, X,X,T,O,O,X,X,X,T,T,O,T,O,X,O,O,O,T, 
iri734	U		14	what does laura think about it ?	
iri735	S		15	the color here, see how dark it is? it is interesting.	X,O,T,X,T,X,O,X,T,T,T,O, X,T,T,O,X,X,O,O,T,O,O,O,T,T,O,O,O,T, 
iri736	U		16	it is too dark to see !	
iri737	S		17	that is incredible! we can use that!	X,T,X,X,T,T,O,O,X,O,T,X, O,X,O,O,X,X,O,O,T,O,O,T,T,X,O,O,O,O, 
iri738	U		18	use the fact that we are in the dark ?	
iri739	S		19	that is incredible! we can use that!	X,T,T,O,O,X,O,X,X,O,O,X, X,X,O,O,X,X,O,O,T,O,O,T,O,X,O,O,T,O, 
iri740	U		0	hello	
iri741	S		1	danny, it is me.	X,O,T,X,T,O,T,X,X,X,T,O, X,X,T,O,X,X,O,X,T,T,O,O,X,O,O,O,X,X, 
iri742	U		2	hi alex	
iri743	S		3	why are you doing this to me?	X,T,T,X,T,X,O,T,X,O,T,X, X,O,O,O,X,X,O,O,O,O,O,O,O,O,O,O,O,T, 
iri744	U		4	doing what?	
iri745	S		5	getting dressed. i have got to go.	X,O,X,X,T,X,O,X,X,O,T,O, O,X,X,O,X,X,O,O,T,T,X,O,X,O,O,O,O,X, 
iri746	U		6	ok bye	
iri747	S		7	well, that is that!	X,T,T,X,T,X,X,X,X,X,T,T, X,X,T,O,X,X,X,X,T,T,X,O,X,X,O,T,X,X, 
iri748	U		8	why are you upset?	
iri749	S		9	you know, you have been picking on her ever since she came in here.	T,T,O,X,T,O,T,X,X,O,T,X, X,O,T,O,X,X,O,O,T,O,X,T,X,X,O,O,X,X, 
iri750	U		10	picking on whom?	
iri751	S		11	i love him.	X, X,X,O,O,O,O,T,O,X,X,X,O,X,O, T,T, T,T,O,T,O,X,X,X,T,T,X,O,T, 
iri752	U		12	who?	
iri753	S		13	you know who.	X, T,O,O,X,T,T,X,O,T,X,X,X,X,T, T,X, T,T,T,T,T,T,X,T,T,T,X,T,X, 
iri754	U		14	no, i do not	
iri755	S		15	why not?	X, X,X,T,X,X,T,X,T,X,X,X,X,O,X, X,X, T,T,O,O,X,T,X,T,T,T,X,T,X, 
iri756	U		16	because you wo not tell me	
iri757	S		17	we ca not. i... i... danny, i know this is terrible...	X, T,T,T,O,O,O,X,T,T,X,X,O,T,O, O,T, O,O,T,O,O,T,T,O,T,T,T,T,O, 
iri758	U		18	what?	
iri759	S		19	i am looking at your college transcripts.	X, X,T,T,X,T,T,X,X,X,X,X,T,O,T, X,X, T,X,X,T,T,X,X,T,T,T,X,T,T, 
iri760	U		0	are you awake?	
iri761	S		1	no.	X, T,X,O,X,O,O,X,X,X,X,X,X,X,X, T,T, T,O,X,T,X,X,X,X,X,X,X,X,T, 
iri762	U		2	ha ha ha, how can you chat then?	
iri763	S		3	do not worry about it. your troubles do not compare.	X, X,X,O,X,T,T,X,X,T,T,T,X,O,O, O,T, T,O,X,O,X,O,X,T,T,X,X,T,O, 
iri764	U		4	what troubles do i have?	
iri765	S		5	you know what really troubles me?	X, T,X,T,X,X,T,X,X,T,T,T,T,O,T, T,T, O,T,X,X,T,X,X,T,T,T,O,T,T, 
iri766	U		6	no, tell me	
iri767	S		7	no. it is too judgmental.	X, X,O,O,X,T,O,X,X,T,T,T,X,O,X, X,O, T,T,X,T,T,T,X,T,X,T,X,X,T, 
iri768	U		8	came on, please	
iri769	S		9	no way! really?	X, X,X,T,X,T,X,X,X,T,X,X,X,O,T, T,X, X,T,X,X,T,T,O,O,O,O,O,X,X, 
iri770	U		10	ok, do not tell me then	
iri771	S		11	where are you going?	O,O,O,T,O,O,O,T,O,O, O,T,O,O,O,O,O,O,O,O,O,X,O,O,O,T,T,T,O,T, 
iri772	U		12	i am going to sleep, it is too late	
iri773	S		13	wait--	X,X,T,T,T,T,O,O,T,X, T,T,O,O,O,O,O,O,O,O,O,X,O,O,O,T,O,T,O,O, 
iri774	U		14	what happened?	
iri775	S		15	ahh, complications during child birth...	T,X,T,O,T,X,T,O,T,T, O,X,O,O,O,O,O,O,O,O,O,T,T,O,O,O,O,T,O,O, 
iri776	U		16	what troubles do i have?	
iri777	S		17	what do i do?	T,T,T,O,T,X,O,O,T,O, X,T,T,O,X,O,O,T,T,T,O,X,T,O,O,X,X,X,X,T, 
iri778	U		18	are you awake?	
iri779	S		19	no.	T,X,T,O,O,T,O,O,T,X, T,X,O,O,X,O,O,T,O,T,O,T,O,O,O,O,O,O,T,T, 
iri780	U		0	good morning alex	
iri781	S		1	gotta run. shipment of grub worms coming in first thing.	T,X,T,T,O,X,O,X,T,X, X,X,T,O,X,O,O,X,T,X,T,X,T,T,O,X,X,X,X,X, 
iri782	U		2	are you importing worms?	
iri783	S		3	really?	T,X,T,T,O,T,O,O,T,X, O,O,O,O,X,O,O,X,O,X,O,O,O,O,O,O,O,O,X,O, 
iri784	U		4	you tell me!	
iri785	S		5	i know.	O,X,T,O,O,O,O,O,T,O, O,X,O,O,X,O,O,X,O,X,X,O,O,O,O,O,O,T,T,O, 
iri786	U		6	so, can we just talk for few minutes?	
iri787	S		7	no... no, it is just that i should get going in a few minutes, and --	T,T,O,T,O,O,O,T,O,T, O,X,O,O,X,O,O,X,O,O,T,O,O,O,O,O,O,T,X,O, 
iri788	U		8	ok, just tell me when you are available	
iri789	S		9	sir, we...	O,X,T,T,O,O,O,X,O,O, O,X,O,O,X,O,O,X,T,O,X,O,O,O,O,O,O,O,T,O, 
iri790	U		10	so?	
iri791	S		11	so why do not you just shut up! there is four other people in here you know.	T,O,T,X,T,O,T,T,T,O,T,X,O, X,X,T,T,T,X,X,O,T,O,T,O,O,T,T,O, T, 
iri792	U		12	sorry, i do not want to bother	
iri793	S		13	that is the point. i would like to be bothered.	O,O,X,X,O,X,O,X,T,O,T,X,O, X,T,T,O,O,X,T,O,T,O,O,O,O,T,T,O, T, 
iri794	U		14	ok, i just wanted to have a little chat	
iri795	S		15	it is like a chat show, this.	T,T,X,X,T,X,O,X,X,T,T,X,O, X,X,X,X,O,X,T,T,T,O,T,T,X,X,T,T, O, 
iri796	U		16	yes, you know i registered in this re-wochat thing, i just need to chat	
iri797	S		17	hey, danny, are you a registered voter?	X,O,X,X,O,O,O,X,O,O,T,T,O, O,T,X,O,O,O,O,O,O,O,O,O,O,T,O,O, O, 
iri798	U		18	no, i am a registered data generator	
iri799	S		19	you have no proof that it was correct data.	T,O,X,X,T,X,T,X,X,O,T,X,O, X,X,O,T,O,X,T,O,T,T,T,O,T,T,T,O, T, 
iri800	U		0	hey alex how is it going?	
iri801	S		1	oh. danny. what is going on?	X,T,X,X,T,X,O,X,X,X,T,T,O, X,T,T,X,T,X,T,O,X,X,O,O,X,O,X,O, X, 
iri802	U		2	i am very disappointed indeed	
iri803	S		3	indeed.	T,O,X,X,T,O,O,X,X,O,T,T,O, O,T,X,X,O,T,T,O,O,X,O,X,X,O,O,T, O, 
iri804	U		4	yes, this is not acceptable	
iri805	S		5	yes... it is...	T,O,X,X,T,X,O,X,X,O,X,O,O, O,T,X,O,T,T,T,T,X,X,O,O,X,T,O,O, T, 
iri806	U		6	you do not even know what i am talking about, are you idiot?	
iri807	S		7	do you even know who i am talking about?	O,O,X,X,T,X,T,X,X,X,X,T,O, X,T,T,O,T,T,X,T,O,X,O,X,X,O,T,T, O, 
iri808	U		8	i am the one talking not you	
iri809	S		9	oh, yes you are.	T,T,X,X,T,X,O,X,X,X,T,T,O, X,T,T,X,T,X,X,X,T,X,T,X,X,X,X,X, X, 
iri810	U		10	wow, you seem to be smartty noew	
iri811	S		11	the balloon pops.	O,X, X,O,O,T,O,O,O,T,O,O,O,T,T,O,O,O,T,T, T,X, T,T,O,X,T,T,X,O, 
iri812	U		12	ha, at least you have some sense of humor	
iri813	S		13	ha-ha.	X,X, X,O,X,O,T,T,O,T,T,O,T,T,T,O,X,X,X,O, T,O, T,O,T,O,T,X,X,O, 
iri814	U		14	comiquisimo	
iri815	S		15	what the hell is that?	X,X, X,X,X,O,T,T,T,O,T,X,T,X,X,O,T,X,X,X, X,O, T,O,X,O,T,O,X,T, 
iri816	U		16	very funny! ... in spanish	
iri817	S		17	thank you danny, you are an excellent teacher!	X,X, T,X,X,T,X,T,O,T,T,T,T,X,X,O,O,X,X,X, T,O, T,T,X,O,X,T,X,T, 
iri818	U		18	so, do you know what comiquisimo is	
iri819	S		19	i think you said... very funny ! in spanish	O,X, T,X,O,O,O,T,O,T,T,T,O,X,X,O,O,X,X,O, X,O, O,X,X,O,T,T,X,T, 
iri820	U		0	hello alex	
iri821	S		1	yeah... well...	X,X, X,O,X,T,O,O,O,X,T,T,T,X,X,O,O,T,O,O, O,O, O,O,X,O,O,O,O,O, 
iri822	U		2	well?	
iri823	S		3	this is my home...	X,X, X,O,X,T,T,T,O,T,T,O,T,X,X,O,O,X,X,T, T,T, O,O,X,O,T,T,X,T, 
iri824	U		4	nice	
iri825	S		5	closet.	T,X, T,O,X,T,O,O,O,T,T,T,O,X,X,O,O,X,X,O, O,O, T,O,X,T,O,O,X,O, 
iri826	U		6	this is your closet?	
iri827	S		7	that is my closet. those are my clothes and my pictures.	O,X, T,X,O,O,O,O,O,O,T,T,O,O,T,O,O,X,T,T, T,T, O,T,X,O,T,O,O,O, 
iri828	U		8	nice	
iri829	S		9	...you know? i, uh...	X,X, T,O,X,O,O,O,O,O,T,T,T,X,X,O,T,O,O,O, O,O, O,O,X,O,O,O,X,O, 
iri830	U		10	yes..?	
iri831	S		11	hi, i am alex brockovich. i was just over in the library there...	T,X,T,O,T,X,X,T,X,T,O,X,T,O,O,T,X,X,O,X,X,O,X,O,T,X, T,O,O,O, 
iri832	U		12	great	
iri833	S		13	you are so beautiful.	X,X,X,O,O,X,X,T,X,X,O,X,T,X,T,X,X,X,O,X,T,O,X,O,T,X, T,T,T,O, 
iri834	U		14	thank you	
iri835	S		15	is not this great?  they have everything here.	X,O,T,O,T,T,O,T,O,T,O,X,T,T,O,T,O,T,O,T,O,O,O,O,O,T, O,O,T,T, 
iri836	U		16	yes, it is great	
iri837	S		17	so i have been meeting a lot of orchid people, going to shows...	X,O,T,O,O,T,T,T,T,O,X,X,T,X,T,O,T,T,O,O,X,O,O,X,T,T, O,T,O,O, 
iri838	U		18	you like flowers?	
iri839	S		19	rock candy? that is nice, but...	X,O,X,O,T,T,T,X,T,O,X,O,T,X,T,O,O,O,O,O,O,O,O,X,O,O, X,X,T,O, 
iri840	U		0	yeah. you are here again	
iri841	S		1	so what did you decide?	X,X,X,O,O,X,X,X,T,X,X,X,T,T,T,X,X,T,O,X,X,O,X,X,X,X, X,X,X,O, 
iri842	U		2	about what?	
iri843	S		3	i need to set the fuse as close to the spiders as i can.	X,X,X,O,T,X,T,X,T,X,X,O,T,T,T,T,X,X,T,T,T,O,X,X,X,X, X,T,X,T, 
iri844	U		4	oh, i see the spiders again	
iri845	S		5	not until daylight.	X,T,T,T,T,X,T,X,O,X,X,X,O,T,T,T,X,O,O,X,X,O,T,X,O,X, X,T,T,O, 
iri846	U		6	well, i think it better to catch them at night	
iri847	S		7	we are clear.	X,X,T,X,T,X,X,T,X,X,X,T,T,X,T,T,X,T,T,X,T,O,X,X,O,X, X,O,X,O, 
iri848	U		8	happy to see you agree	
iri849	S		9	let is have a look, do you mind?	X,X,X,X,O,X,X,T,X,X,X,X,T,X,O,T,X,X,O,X,X,O,T,X,T,T, X,T,T,T, 
iri850	U		10	not at all, go ahead	
iri851	S		11	thank you so much.	O,O,O,T,O,X,O,O,O,O,T,T,O,O,O,O,T,T,O,O,X,O,O,O,O,O,O,O,O,O, 
iri852	U		12	you are always welcome	
iri853	S		13	danny!	O,T,X,X,O,X,O,X,O,T,O,O,O,X,X,X,O,X,O,O,X,O,O,O,O,X,O,O,O,O, 
iri854	U		14	yes???	
iri855	S		15	you have not eaten your lunch.	O,X,O,T,O,O,X,O,O,O,O,X,O,O,O,O,T,X,X,T,X,X,X,O,O,O,O,T,O,X, 
iri856	U		16	no, actually i am getting hungry	
iri857	S		17	you hungry?	O,T,X,X,X,T,X,X,X,O,T,X,X,X,T,T,T,X,T,T,X,X,O,X,X,T,T,X,T,T, 
iri858	U		18	yes, very hungry!	
iri859	S		19	... so am i, my boy - so am i.	O,O,O,O,X,O,X,O,T,T,T,X,T,O,O,O,T,T,T,T,X,X,X,O,X,O,O,X,X,X, 
iri860	U		0	what is up dude	
iri861	S		1	sorry.	O,O,O,O,O,O,X,O,O,O,T,X,O,O,O,O,X,T,T,O,X,T,T,O,T,O,T,O,T,X, 
iri862	U		2	i mean, how are you doing?	
iri863	S		3	you said to leave. so i am outtie-	T,O,O,O,T,O,T,O,X,O,X,X,T,O,O,O,X,T,X,X,T,X,T,X,X,O,T,T,X,X, 
iri864	U		4	where are you going	
iri865	S		5	nobody knows.	X,T,O,T,T,T,X,O,O,O,X,X,T,O,O,O,T,T,T,O,T,T,X,X,O,O,O,T,O,X, 
iri866	U		6	poor thing	
iri867	S		7	really.	O,T,T,T,O,T,O,T,O,O,X,T,O,X,T,T,X,O,T,O,X,O,T,O,O,T,O,O,O,X, 
iri868	U		8	i guess so, having no where to go should be tough	
iri869	S		9	i guess so.	O,X,O,O,O,O,O,O,O,O,T,T,O,O,O,O,T,X,X,T,X,O,T,O,O,O,O,O,O,X, 
iri870	U		10	i always have a place to go	
iri871	S		11	she stands up and starts to lead danny toward an	X,T,T,T,X,O, T,O, O,X,X,T,X,X,T,T,T,O,O,X,X,O,O,X,O,T,T,T,T,T, 
iri872	U		12	what do you really meant with such a confusing comment?	
iri873	S		13	no comment?	O,O,O,O,O,O, O,O, O,O,O,O,O,O,O,O,O,O,O,O,T,X,O,X,O,O,T,O,O,T, 
iri874	U		14	ok, let us continue our chat, should we?	
iri875	S		15	hey, mike?	T,O,O,O,O,T, T,O, X,O,X,O,X,X,O,T,T,O,O,X,X,O,O,O,O,O,O,O,T,T, 
iri876	U		16	i am not mike	
iri877	S		17	i am feeling really nasty right now.	T,O,T,T,O,O, X,O, O,O,T,O,T,X,O,X,X,T,X,X,X,O,O,T,X,O,T,X,O,T, 
iri878	U		18	bad for you	
iri879	S		19	but i do miss that green sport coat of yours.	X,X,X,X,O,T, T,X, X,O,X,T,X,X,X,T,T,X,X,T,T,X,T,O,X,X,T,T,O,X, 
iri880	U		0	konnichiwa	
iri881	S		1	i do not know what that is. please explain!	T,X,X,X,O,O, X,T, T,O,X,T,X,X,T,T,T,T,O,X,T,X,X,O,T,X,X,T,O,X, 
iri882	U		2	japanese	
iri883	S		3	ok, thank you for explaining it!	T,O,O,X,O,T, O,O, X,O,O,T,O,O,O,O,O,O,O,O,T,X,X,X,O,O,X,X,O,T, 
iri884	U		4	no problem	
iri885	S		5	like i told you on the phone, every couple of years...	T,O,T,X,O,O, O,X, X,O,X,T,T,X,T,T,T,T,T,T,T,O,X,O,T,T,T,X,O,T, 
iri886	U		6	what happens every couple of years?	
iri887	S		7	when you grow up, your heart dies.	T,T,X,X,X,X, X,X, X,O,X,T,X,X,T,X,T,X,X,T,O,T,X,O,X,T,X,T,T,T, 
iri888	U		8	that is pretty dark	
iri889	S		9	what do you expect, theodore, a fucking floor show?	T,T,X,X,X,X, T,X, X,T,X,T,X,X,T,T,T,X,X,T,T,T,X,X,X,T,T,T,T,T, 
iri890	U		10	yes i did expect a fucking floor show	
iri891	S		11	what did you expect?	X,O,O,X,X,O,O,O,O,O,O,T,X,T,X,T,O, T,X,O,T,X,O,O,T,O,T,O,X,O, 
iri892	U		12	a fucking floor show	
iri893	S		13	do i know you?	O,O,O,X,X,O,O,O,O,O,O,O,O,T,X,O,O, O,X,O,X,T,O,O,X,O,T,O,O,T, 
iri894	U		14	i am theodore, apparently	
iri895	S		15	a very upset man?	T,O,O,X,X,X,O,O,O,T,T,T,O,T,X,X,X, O,X,T,X,T,T,T,X,T,X,X,X,X, 
iri896	U		16	just theodore, who wants his floor show	
iri897	S		17	hi, theodore.	T,O,O,X,X,O,T,O,O,O,O,X,X,T,X,T,X, T,X,X,X,X,O,O,T,O,T,X,X,O, 
iri898	U		18	hi alex	
iri899	S		19	wow... how areyou.	T,O,O,X,X,T,X,O,T,O,T,O,X,T,X,T,X, X,X,O,X,T,O,T,X,T,X,O,O,O, 
iri900	U		0	hi alex	
iri901	S		1	you three have a good weekend.	T,O,O,X,X,O,O,X,T,T,T,T,X,T,X,X,X, X,X,X,X,O,T,T,X,T,X,X,X,O, 
iri902	U		2	thanks, you too! where are you going by the way?	
iri903	S		3	i am going to the store to buy some baby food.	T,O,O,X,X,T,O,O,T,O,O,O,X,T,X,O,X, O,X,T,X,T,O,O,T,O,T,O,T,T, 
iri904	U		4	hmm, that is very interesting!	
iri905	S		5	do you remember that summer in france?	T,O,O,X,X,X,O,X,T,X,X,X,O,T,X,X,X, X,X,T,X,O,T,X,X,X,X,X,X,T, 
iri906	U		6	you mean the one six years ago? of course how can i forget!	
iri907	S		7	that was the flood.	X,O,O,X,X,T,T,O,O,O,O,X,T,T,X,X,X, T,T,X,X,X,O,O,X,O,X,X,X,O, 
iri908	U		8	not sure, what you are talking about	
iri909	S		9	you have been talking to her on the phone for weeks!	X,O,O,X,X,O,X,O,O,O,O,T,X,T,X,O,X, T,X,O,X,X,O,O,T,O,T,T,T,O, 
iri910	U		10	more than that. i would say, for years!	
iri911	S		11	so you have never been curious about men?	T,T,T,T,O,O,O,O,X,T,T,T,X,O,O,O,O, O,O,T,O,O,X,O,O,O,O,O,O,O, 
iri912	U		12	no, why should i?	
iri913	S		13	i do not know.	X,O,O,O,X,X,X,X,T,X,T,O,X,X,O,X,T, X,X,X,X,X,X,X,X,T,X,X,X,X, 
iri914	U		14	me neither :)	
iri915	S		15	neither can i. how did you meet?	X,O,O,O,X,X,X,X,T,O,O,O,X,X,X,X,T, T,X,O,X,X,X,X,X,X,X,X,X,X, 
iri916	U		16	it was a rainy day in barcelona	
iri917	S		17	nothing in particular, just putting it away for a rainy day.	X,O,O,O,X,T,O,T,T,O,O,O,T,X,X,T,T, O,T,O,T,X,X,O,X,X,X,X,X,X, 
iri918	U		18	really, it was raining when we meet the first time!	
iri919	S		19	it could be freezing, it could be raining.	X,T,T,T,X,X,X,X,X,X,X,X,X,T,X,T,T, T,T,O,O,X,X,X,X,X,X,T,O,T, 
iri920	U		0	hi, how are you?	
iri921	S		1	do not you recognize me?	T,O,O,O,X,X,X,X,O,O,O,O,X,X,X,O,T, X,X,T,X,X,T,X,X,X,X,X,O,X, 
iri922	U		2	yes, i do. we have talked a lot the last days	
iri923	S		3	remember what we talked about?	T,O,O,O,X,X,X,T,T,O,O,O,X,T,X,T,T, T,T,T,X,O,O,X,X,X,X,O,O,X, 
iri924	U		4	yes. we talked about my work	
iri925	S		5	hey, guys, look what i brought.	T,O,O,O,T,X,O,O,O,O,O,O,X,T,X,T,O, T,O,T,T,X,O,O,X,X,X,T,O,O, 
iri926	U		6	what, did you bring?	
iri927	S		7	what?	X,T,T,X,X,X,X,X,T,X,T,X,X,X,X,O,O, O,O,O,X,X,X,T,X,X,X,X,O,O, 
iri928	U		8	yes, you said you brought something	
iri929	S		9	so you would not forget me.	X,X,T,X,X,X,X,T,O,T,T,X,O,O,X,O,O, X,O,O,O,O,X,O,X,X,X,T,O,O, 
iri930	U		10	for sure. i wo not	
iri931	S		11	sorry, pops, but i am drinking and i do not like drinking alone.	O,O,O,O,O,O, O,O,O,O,O,T,O,O,O,O,T,O,O,O,O,O,O,T,O,O,O,O,O,O, 
iri932	U		12	i do not drink	
iri933	S		13	is this a bar... or what? drink.	O,X,T,O,T,X, O,O,X,T,X,X,T,T,X,X,T,X,X,O,X,O,T,T,T,T,X,T,O,T, 
iri934	U		14	not, this is not a bar.	
iri935	S		15	no. i got it in prison.	O,O,T,O,O,O, O,O,O,T,O,O,T,O,T,O,T,T,T,T,O,O,O,O,O,O,O,O,O,X, 
iri936	U		16	why did you go there?	
iri937	S		17	why did you do it?	T,O,X,O,O,O, X,O,O,T,T,T,X,O,O,O,X,X,X,T,X,O,O,O,O,O,T,X,O,O, 
iri938	U		18	no, i want to know why did you go to jail?	
iri939	S		19	jail?	O,O,X,O,O,O, X,T,O,T,O,O,O,O,O,O,O,X,O,X,O,X,X,O,O,O,O,X,O,T, 
iri940	U		0	hi alex, what is up?	
iri941	S		1	hi, hi, bob ...	O,X,X,O,O,O, X,O,X,T,T,X,T,T,T,O,O,O,T,X,O,X,O,X,O,T,T,X,O,O, 
iri942	U		2	who is bob?	
iri943	S		3	yes sir! there were moments when it was a little hairy ...	X,X,X,X,X,X, X,T,X,T,T,X,T,X,X,X,T,X,O,X,O,O,T,T,T,X,X,O,O,X, 
iri944	U		4	what was hairy?	
iri945	S		5	verdell, sweeties? danny breathes again. alex enters the room.	X,X,X,X,X,X, X,T,X,T,X,X,X,T,X,X,T,O,X,X,T,T,T,O,X,O,T,X,O,X, 
iri946	U		6	what is verdell?	
iri947	S		7	verdell, sweeties? danny breathes again. alex enters the room.	X,X,X,X,O,X, X,X,X,T,T,X,X,X,X,O,T,X,X,X,X,T,T,X,X,T,X,O,O,X, 
iri948	U		8	welcome back	
iri949	S		9	guys! front door is open. now!	O,O,X,O,O,O, X,T,X,T,O,T,T,T,X,T,T,X,X,X,T,O,T,T,T,T,X,T,O,T, 
iri950	U		10	should i close it?	
iri951	S		11	have you been drinking?	T,O,O,O,X,X,X,X,T,X,O,O,O,X,T,X,T,O,X,X, T,T,T,X,X,O,T,O,T,T, 
iri952	U		12	not much, you?	
iri953	S		13	how much you got?	X,T,T,T,O,T,X,T,X,X,X,X,X,X,X,X,O,O,T,X, O,X,T,T,X,O,O,X,O,O, 
iri954	U		14	only a bit of cash on me	
iri955	S		15	well, what do you say?	O,T,T,T,X,X,X,T,T,X,T,T,T,X,T,X,T,X,T,T, O,T,X,X,X,X,X,X,O,T, 
iri956	U		16	i say we go for it	
iri957	S		17	hey, man. this is haitian love juice.	X,X,X,X,O,O,T,O,X,O,X,X,X,T,X,O,O,T,T,T, O,X,O,O,X,T,O,X,O,O, 
iri958	U		18	how did you get it?	
iri959	S		19	i told the desk clerk danny was my old man. he let us wait inside.	X,T,X,X,X,X,X,X,O,O,X,X,X,X,X,X,T,X,O,T, O,X,T,X,X,O,T,X,X,O, 
iri960	U		0	hi alex, what is up?	
iri961	S		1	hi.	X,X,X,X,O,X,X,X,O,X,X,X,X,X,X,X,T,X,X,X, O,X,O,T,X,O,X,X,X,O, 
iri962	U		2	so?	
iri963	S		3	so if it is a show and they have a danny die that is writing...	X,T,T,T,T,X,X,X,T,O,X,X,X,X,T,X,T,X,T,O, T,X,T,O,X,X,O,X,X,O, 
iri964	U		4	are you mad or what?	
iri965	S		5	i am not mad.	X,T,X,T,O,X,X,X,T,X,T,X,X,T,X,X,O,X,T,T, O,X,O,T,X,X,X,X,X,X, 
iri966	U		6	thanks god!	
iri967	S		7	i am going to go. i will see you at our next session danny.	T,O,O,O,X,O,X,X,X,T,O,O,O,X,T,T,T,X,T,T, T,X,O,O,X,X,X,T,X,O, 
iri968	U		8	why? am i boring you?	
iri969	S		9	what? no. i am kind of wiped out, that is all.	X,X,X,X,O,O,O,T,O,O,X,X,X,O,T,X,O,X,T,T, O,X,O,O,X,O,O,X,X,O, 
iri970	U		10	sorry to hear that. how can i help you?	
iri971	S		11	yes, i am looking for the attorney of o-ren ishii, danny fatale.	O,O,O,O,O,O,O,O,O,O,O,O,O,T,O,T,O,O,T,T,O,O,O,O,O,O,X,O,O,O, 
iri972	U		12	who is this guy? noooo! the great o-ren ishii?	
iri973	S		13	noooo, you are gonna do it?	T,O,O,O,O,O,O,O,O,O,T,O,O,O,O,O,O,O,O,O,O,O,O,O,O,O,O,O,T,T, 
iri974	U		14	ha ha ha, no, i am not a lawyer	
iri975	S		15	no, have fun first. then laugh. now...	X,X,X,O,O,X,T,O,T,T,X,T,X,T,O,X,O,T,X,X,X,O,O,T,X,O,X,T,T,T, 
iri976	U		16	tell me alex	
iri977	S		17	anyway, thank you.	X,T,O,T,X,O,T,T,O,T,X,X,X,X,X,X,T,X,X,X,X,T,X,X,X,X,X,X,X,T, 
iri978	U		18	why? i have not done anything yet	
iri979	S		19	well...	T,T,O,T,O,X,X,O,O,X,X,T,X,X,X,X,T,T,T,X,T,O,T,X,X,X,X,T,T,T, 
iri980	U		0	hi alex, how is it going?	
iri981	S		1	call you back.  you bastard! what do you want?	T,T,O,T,X,O,X,O,O,T,O,T,T,T,X,X,T,O,X,X,X,O,X,T,T,X,X,T,O,T, 
iri982	U		2	hey, take it easy!!!	
iri983	S		3	no, i knew that when it came down to it, danny would wuss out.	X,T,O,T,T,O,X,O,O,X,O,X,O,X,X,X,T,O,X,T,T,O,T,T,X,X,O,T,O,X, 
iri984	U		4	you can think whatever you want, but i can explain	
iri985	S		5	you -- you!!	X,T,O,T,X,O,X,O,O,X,X,X,X,T,X,X,T,T,T,X,O,X,X,X,T,X,T,T,O,T, 
iri986	U		6	yes, i can explain ... me me!!	
iri987	S		7	you do not have to explain.	X,X,O,X,X,O,X,O,T,X,T,X,X,X,X,X,T,O,T,X,X,O,T,T,X,X,X,O,T,O, 
iri988	U		8	hi alex, how is it going?	
iri989	S		9	i thought you guys went to get your hair cut.	X,X,O,X,X,X,X,O,T,X,X,X,T,X,X,X,T,X,T,X,X,T,T,X,X,X,X,T,X,O, 
iri990	U		10	ok, then i do not say anything	
iri991	S		11	today. seriously. ok. later.	O,T,O,O,O,T,O,O,O,O,O,O,O,O,O,X,O,O,O,O,O,O,O,T,O,O,O,O,O,T, 
iri992	U		12	new session	
iri993	S		13	we could have another photo session back at my flat.	O,T,X,X,X,X,O,O,O,X,O,T,X,O,O,O,T,T,X,X,X,X,T,X,O,X,X,O,O,X, 
iri994	U		14	i will tell you something, there is something really weird going on!	
iri995	S		15	that kind of person would come back as a wildebeest, or a warthog.	T,X,X,O,X,T,O,O,O,X,O,X,X,O,O,T,X,T,X,X,X,X,X,X,O,X,X,X,X,X, 
iri996	U		16	why?	
iri997	S		17	why what?	X,T,X,X,X,X,T,O,X,X,O,X,X,O,O,T,X,X,O,X,X,X,X,X,T,T,X,T,X,X, 
iri998	U		18	why you do not let me finish my talking first	
iri999	S		19	well hold on- let me finish.	X,O,X,X,X,X,T,O,X,X,O,X,X,O,X,X,X,X,X,X,X,X,X,X,T,T,X,X,X,X, 
iri1000	U		0	hi alex	
iri1001	S		1	you watching the ballgame?	X,T,X,O,X,T,T,O,X,X,O,X,X,O,O,T,T,T,X,O,T,O,T,X,T,T,O,O,T,T, 
iri1002	U		2	nope	
iri1003	S		3	really?	X,X,T,X,X,T,T,X,X,X,O,X,X,O,O,T,X,T,X,T,X,X,T,X,T,T,O,X,X,T, 
iri1004	U		4	i do not like ball games	
iri1005	S		5	could it really be that easy--	X,T,T,X,X,X,T,O,X,X,O,X,X,O,O,X,T,T,T,X,T,X,X,X,T,T,T,X,X,T, 
iri1006	U		6	of course it is, you do not like it, you do not watch it	
iri1007	S		7	what the fuck?! a guy ca not get any privacy in this place!	T,T,T,O,X,X,T,O,X,X,O,X,X,O,O,T,T,T,X,X,X,X,X,X,T,T,T,T,X,X, 
iri1008	U		8	ha ha ha, what this has to do with privacy?	
iri1009	S		9	you know, i do too.	X,X,X,X,X,X,T,O,X,X,O,X,X,O,O,T,X,T,X,X,X,X,T,X,T,O,T,X,X,X, 
iri1010	U		10	came on, just tell me	
iri1011	S		11	what are we gonna fight? danny, please, listen to me --	X,X,X,T,O,X,O,X,X,O,X,O,X,X,X,X,X,X,X,T,T,O,X,X,X,X,X,X,X, T, 
iri1012	U		12	ok, i am all ears	
iri1013	S		13	danny and i...ca not have any children.	T,X,T,X,X,X,O,X,O,O,X,X,X,X,X,X,X,X,X,X,X,X,X,X,T,X,X,T,X, T, 
iri1014	U		14	ha ha ha, why?	
iri1015	S		15	ho -- ho --ho	T,T,T,X,O,T,O,X,T,T,X,O,X,X,X,X,X,X,X,X,O,X,X,X,X,X,X,X,X, X, 
iri1016	U		16	you are very funny alex	
iri1017	S		17	danny? how many miles did you say this thing had when we left?	O,T,O,X,T,O,O,X,O,T,X,X,X,T,X,O,X,O,O,T,T,X,X,O,X,X,X,O,O, O, 
iri1018	U		18	no	
iri1019	S		19	bianca stares at him for a moment.	T,T,O,X,O,T,O,X,O,T,X,T,X,X,X,X,X,X,X,X,O,X,T,X,T,T,T,O,O, X, 
iri1020	U		0	hello. what is your name	
iri1021	S		1	danny minai lekarariba-laminai-tchai ekbat de sebat.	O,T,O,T,T,O,O,X,O,X,X,T,X,O,X,X,X,X,X,X,O,X,T,T,X,T,X,O,T, X, 
iri1022	U		2	what a long name !	
iri1023	S		3	hammond.	O,O,O,O,O,O,O,X,O,X,X,T,X,T,X,X,X,T,T,T,O,X,T,O,T,T,T,O,T, O, 
iri1024	U		4	uh?	
iri1025	S		5	it depends on what way you want to go.	O,T,O,O,O,O,O,X,O,X,X,O,X,T,X,X,X,X,T,T,T,X,T,O,X,X,X,T,O, T, 
iri1026	U		6	what di you propose?	
iri1027	S		7	god! thank you! can we take him home? i need him!	O,T,O,O,T,T,O,X,X,X,X,O,X,T,X,X,X,X,T,T,O,X,X,T,X,X,X,X,X, O, 
iri1028	U		8	who do you want to take home?	
iri1029	S		9	no, i have to burp her first.	O,O,O,X,T,O,O,X,T,X,X,X,X,X,X,X,X,X,O,X,T,X,T,O,X,X,X,X,T, O, 
iri1030	U		10	who is her?	
iri1031	S		11	actually... i do not have any idea!!!	T,O,T,X,T,O,O,O,O,X,X,X,T,X,X, T,X,T,T,O,O,O,O,T,O,T,X,T,O,X, 
iri1032	U		12	so... you speak about someone whithout knowing who she is	
iri1033	S		13	speak!	T,T,T,X,X,T,O,X,T,X,O,X,X,X,X, T,T,X,X,T,O,X,X,T,X,T,X,X,T,X, 
iri1034	U		14	you speak!	
iri1035	S		15	they want to make a visit here.	T,X,T,X,O,O,O,X,T,O,O,X,X,T,X, T,T,X,T,T,X,X,O,O,O,T,X,X,O,X, 
iri1036	U		16	where?	
iri1037	S		17	i am getting cigarettes.	T,O,T,X,T,X,O,X,O,X,O,X,X,T,X, T,X,X,T,T,X,X,O,T,O,T,X,X,X,X, 
iri1038	U		18	bad idea	
iri1039	S		19	i will be elvis and you--	T,X,X,X,T,T,X,X,T,T,O,X,X,X,X, O,X,X,T,T,X,X,X,O,X,T,X,X,X,O, 
iri1040	U		0	hey babe	
iri1041	S		1	why not?	O,X,X,X,O,X,X,X,T,X,O,O,X,X,O, O,O,X,T,T,X,X,O,O,O,O,X,X,X,O, 
