id	speaker	time	turn-index	utterance	annotations
iri0	U		0	hi alex	
iri1	S		1	you three have a good weekend.	T,O,O,T,O,X, X,X,O,X,O,X,X,X,T,O,X,X,X, O,O,X,X,X,T,X,T,X,X,X, 
iri2	U		2	thanks	
iri3	S		3	now come on, let is get out of here. i am freezing and mr.	O,X,T,T,T,X, X,O,O,O,T,X,O,X,O,T,O,X,X, O,T,X,T,O,T,X,X,O,X,O, 
iri4	U		4	it is quite cold here	
iri5	S		5	it is  wouldpose to be cold.	O,T,T,O,T,O, O,O,O,O,T,O,O,O,O,O,O,T,T, O,X,X,T,O,O,X,O,O,X,O, 
iri6	U		6	i suppose	
iri7	S		7	you can leave it there. a beat. does she really mean it?	X,O,O,T,O,X, X,X,O,O,X,X,X,X,X,T,X,X,X, O,O,O,O,X,O,T,X,X,T,T, 
iri8	U		8	i do not know	
iri9	S		9	i think it is totally weak.	X,T,T,O,T,T, T,O,O,O,T,X,X,X,T,T,T,X,X, O,T,T,T,X,O,T,X,X,X,O, 
iri10	U		10	maybe	
iri11	S		11	maybe – maybe! i do not want any maybe.	O,T,X,O,X,O, O,O,O,O,X,O,O,X,O,T,O,X,T, O,T,X,O,O,T,T,T,O,X,O, 
iri12	U		12	what do you want?	
iri13	S		13	were you asleep?	X,O,O,T,T,X, X,X,O,O,X,X,O,X,X,X,X,X,T, X,O,O,T,X,T,O,X,X,X,X, 
iri14	U		14	when?	
iri15	S		15	in a minute, look it is hot, sweetie you will burn your nose, look out.	X,X,T,T,T,X, X,X,O,T,X,X,X,X,T,X,X,X,X, O,X,X,T,X,T,X,X,O,X,X, 
iri16	U		16	what?	
iri17	S		17	the radio is gone... that means--the car is gone!	X,T,T,T,X,X, X,X,O,O,X,T,X,X,X,X,X,X,X, O,X,X,T,X,T,T,X,X,X,X, 
iri18	U		18	what car?	
iri19	S		19	i have an idea for that.	X,O,O,X,T,X, X,X,O,X,X,X,T,X,X,X,X,X,X, X,O,T,T,X,T,T,X,X,X,X, 
iri20	U		0	hi alex, you still there	
iri21	S		1	so you have been told you have cancer. well...	X,T,O,T,T,T,O,O,O,T,O,X,T,T,O,X,O,O,X,O,X,X,X,X,T,O,T,T,T,X, 
iri22	U		2	no, i do not think so	
iri23	S		3	you do not like it.	X,T,O,T,T,T,O,O,O,X,O,X,O,X,O,O,T,O,X,O,X,T,X,T,T,T,T,T,X,X, 
iri24	U		4	of course not!!!	
iri25	S		5	what i mean is, do you really know what is going on in his head?	T,X,O,T,O,O,T,O,T,T,O,X,T,O,O,X,T,O,X,O,O,T,X,X,O,T,O,O,O,X, 
iri26	U		6	no	
iri27	S		7	i told you a thousand times you should always keep, uh...	T,X,X,X,T,T,T,O,X,X,O,X,X,O,O,O,O,O,X,O,X,T,X,X,T,T,O,O,O,X, 
iri28	U		8	sorry, but i forgot	
iri29	S		9	side-kick drives away. grierson turns to david.	X,X,X,X,X,X,O,O,X,X,X,X,X,X,O,T,O,X,X,X,X,X,X,X,T,O,T,T,T,X, 
iri30	U		10	what???	
iri31	S		11	joey points	X,X,X,X,T,T,T,O,X,X,X,X,X,X,O,T,O,X,X,X,X,X,X,X,T,O,T,T,T,X, 
iri32	U		12	you are like crazy today	
iri33	S		13	dad, this is not actually what he is like. he took some drugs and--	T,X,X,X,T,T,T,O,O,T,X,X,X,O,O,X,T,X,X,X,X,X,X,X,T,O,T,O,T,X, 
iri34	U		14	helloooo	
iri35	S		15	leave it	T,X,X,X,T,X,T,O,X,X,T,X,X,X,O,O,T,O,X,O,X,X,X,X,T,T,X,X,X,X, 
iri36	U		16	you, leave it, can we just talk?	
iri37	S		17	he persists.	X,T,X,T,X,T,T,O,X,X,X,X,T,O,O,T,O,O,X,X,X,T,X,T,T,O,T,T,T,X, 
iri38	U		18	who is he anyway?	
iri39	S		19	well... why are you asking this, by the way?	T,X,X,O,O,T,T,O,X,T,O,X,T,X,O,T,T,X,X,O,O,T,O,O,O,T,O,O,O,O, 
iri40	U		0	hi alex	
iri41	S		1	hi.	O,O,O,O, O,O,O,O,O,X,O,T,O,O,O,O,O,O,O,O,O,O,O,X, O,O,O,O,O,O, 
iri42	U		2	how are you doing today?	
iri43	S		3	i am killing myself.	T,T,O,T, T,O,O,X,X,T,X,X,O,O,X,T,O,X,T,X,O,O,T,X, T,T,O,O,O,T, 
iri44	U		4	why?	
iri45	S		5	well, i think --	T,O,O,T, O,O,O,X,X,O,X,T,X,O,O,T,X,T,O,X,O,X,T,X, X,O,O,O,T,X, 
iri46	U		6	about what?	
iri47	S		7	yeah, i heard about that.	X,T,T,T, X,T,X,X,X,X,X,T,O,T,X,X,X,T,X,X,O,X,X,X, X,X,T,O,X,T, 
iri48	U		8	what?	
iri49	S		9	i think you have a gray hair.	X,X,X,O, T,T,X,X,T,T,T,X,X,O,O,T,X,O,X,X,O,X,X,T, X,X,X,O,X,O, 
iri50	U		10	you are right	
iri51	S		11	it is like the days of the mad barber of fleet street, is not it?	T,X,X,O, T,T,X,X,X,T,X,O,X,O,X,X,O,X,T,X,O,X,X,O, X,X,X,O,X,T, 
iri52	U		12	yes	
iri53	S		13	i would like to thank you for filling in on such short notice for the vice president.	X,X,X,T, T,T,T,X,O,T,T,T,X,O,X,T,X,X,X,X,O,X,X,T, X,X,X,O,X,O, 
iri54	U		14	do you have a car?	
iri55	S		15	you lying son of a bitch...	X,X,X,X, X,T,X,X,X,X,T,X,X,T,X,X,X,X,X,X,X,X,X,X, X,X,X,T,X,X, 
iri56	U		16	do you have a car?	
iri57	S		17	this car.	O,X,X,T, X,T,X,X,X,T,X,X,X,O,O,X,X,T,X,T,X,X,X,X, X,T,X,T,X,T, 
iri58	U		18	do you have a car?	
iri59	S		19	could you please say something different?	X,T,X,T, X,X,X,X,T,T,T,O,X,O,X,X,O,T,O,T,T,X,T,T, X,X,O,T,X,X, 
iri60	U		0	i am back again	
iri61	S		1	my house is just a couple of blocks away.	T,O, X,X,X,O,O,T,O,O,O,T,T,T,O,T,T, X,X, O,O,X,O,O,T,T,X,T,X,T, 
iri62	U		2	good, are we going there?	
iri63	S		3	what are we going to do?	O,O, T,T,O,O,T,T,O,T,O,X,T,T,T,X,T, T,T, O,T,T,T,O,O,T,O,O,T,O, 
iri64	U		4	have some food for dinner, i can cook	
iri65	S		5	yes.	T,O, X,O,X,O,O,O,O,T,O,T,X,T,O,T,O, O,O, T,O,O,X,O,O,T,X,T,T,O, 
iri66	U		6	rendang	
iri67	S		7	please explain that to me!	O,O, T,O,X,O,O,O,O,X,O,T,X,X,T,O,T, T,O, O,T,O,T,O,O,T,X,O,X,O, 
iri68	U		8	rendang is a spicy meat dish which originated from the minangkabau ethnic group of indonesia	
iri69	S		9	ok, thank you for explaining it!	T,O, X,O,X,T,O,T,O,X,O,T,O,O,O,O,O, O,O, O,O,O,X,O,O,O,O,O,O,O, 
iri70	U		10	do you like rendang	
iri71	S		11	... a group from the ...	X,O, X,X,T,T,X,T,X,X,T,X,X,X,T,X,X, X,X, T,X,X,X,T,X,T,X,X,X,X, 
iri72	U		12	rendang	
iri73	S		13	... a group from the ...	X,O, T,X,T,T,X,T,X,X,X,X,X,X,X,X,X, X,X, T,X,X,X,X,X,X,X,X,X,X, 
iri74	U		14	rendang	
iri75	S		15	it is not the dish--	X,O, T,X,T,T,X,O,T,X,T,T,X,X,X,X,T, X,X, X,X,X,X,T,T,X,X,O,X,X, 
iri76	U		16	why the sequence is not in order	
iri77	S		17	everything is in order.	T,O, T,X,X,O,X,T,O,X,X,T,T,T,T,X,X, T,T, O,X,O,X,T,T,T,O,O,T,O, 
iri78	U		18	i do not think so, let me check the logs	
iri79	S		19	check.	T,O, T,O,X,T,O,O,O,X,X,O,T,T,T,X,T, T,T, T,X,O,X,T,T,O,O,T,T,O, 
iri80	U		0	hi alex	
iri81	S		1	you three have a good weekend.	O,T,O,X,O,O,X,X,X,T,X,X,O,O,T,X, T,O,X,T,X,X,X,X,X,X,X,X,X,O, 
iri82	U		2	yes. how did you know it?	
iri83	S		3	squash it.	O,X,X,X,O,T,T,X,X,X,X,X,T,X,T,X, X,X,X,X,T,X,T,T,X,X,X,X,O,T, 
iri84	U		4	ok. good.	
iri85	S		5	wait!	O,X,O,X,T,O,O,T,T,X,T,T,T,X,O,X, T,X,X,T,T,T,X,X,O,T,T,T,O,T, 
iri86	U		6	for what?	
iri87	S		7	no matter what you think, you did come up with something unique.	O,X,O,X,O,X,T,T,X,T,T,X,T,X,X,X, X,X,X,X,X,T,X,X,X,X,T,X,T,T, 
iri88	U		8	thank you.	
iri89	S		9	now i want you to do something for me.	O,X,O,X,O,O,T,T,T,T,X,T,O,O,O,X, O,X,X,O,T,X,T,T,O,X,T,O,T,O, 
iri90	U		10	tell me	
iri91	S		11	he is taking care of the same business i will be taking care of - soon as i dry off.	O,X,X,X,T,X,T,T,T,X,X,X,T,X,T,X, X,X,X,X,X,X,X,X,T,X,X,O,O,T, 
iri92	U		12	ok. but it is not clear what do you want from me?	
iri93	S		13	yeah.	X,X,X,X,O,O,T,X,X,X,X,O,O,X,T,X, X,X,X,X,X,X,X,T,T,X,X,X,O,T, 
iri94	U		14	tell me clearly	
iri95	S		15	you are rich. what do you have to worry about?	O,X,X,X,T,O,O,O,O,X,O,X,O,X,X,X, X,X,X,T,X,O,X,X,T,O,O,X,O,T, 
iri96	U		16	i am not worry about anything	
iri97	S		17	do not worry about it.	O,X,T,O,T,O,T,X,X,T,X,O,T,T,T,X, T,X,T,O,T,X,X,T,O,X,X,T,O,T, 
iri98	U		18	ok. sure.	
iri99	S		19	yeah. they just need me downtown in half an hour for a news conference with the deputy mayor.	O,X,O,O,T,O,T,X,X,T,X,O,T,X,X,X, T,X,X,O,X,X,X,X,O,X,X,X,O,O, 
iri100	U		0	hi alex	
iri101	S		1	oh, my god. how old are you, you slut?	X,X,O,T,X,X,T,O,X,X,O,X,X,X,T,X,X,X,X,X,T,O,T,X,T,X,T,T,X,X, 
iri102	U		2	that is so rude	
iri103	S		3	you guys were way rude. it was shocking.	T,O,O,O,X,T,X,O,X,O,O,X,X,O,O,X,O,X,O,O,T,T,T,O,T,X,X,T,X,O, 
iri104	U		4	how are you?	
iri105	S		5	i could not sleep, i did not want to bug you.	T,T,O,O,X,T,T,O,X,O,O,X,T,O,X,X,X,X,T,T,O,T,X,T,O,X,X,X,X,O, 
iri106	U		6	what do you think about the new prime minister?	
iri107	S		7	let is hope so! cause if i did not we are gonna look like burnt out toaster ovens!	T,X,O,X,X,T,T,O,X,O,X,X,O,X,X,X,X,X,X,X,X,X,X,O,X,X,X,X,X,X, 
iri108	U		8	how old are you?	
iri109	S		9	i am thirteen, how old are you?	O,O,O,X,O,O,O,O,X,O,X,X,O,O,X,X,X,X,O,O,O,O,X,O,O,O,T,T,O,X, 
iri110	U		10	i am 25	
iri111	S		11	what are we going to do? i do not know what to do.	O,X,O,O,X,O,O,O,X,O,X,X,O,O,X,X,X,X,T,X,T,O,X,O,O,T,X,T,O,O, 
iri112	U		12	we can just talk for a little while	
iri113	S		13	can we talk?	O,O,O,O,X,T,O,O,X,O,X,X,O,O,X,X,X,X,O,T,T,O,X,T,O,T,T,T,T,O, 
iri114	U		14	yes. what do you want to talk about?	
iri115	S		15	anything. anything at all.	O,O,O,X,O,O,O,O,X,O,X,X,T,O,X,X,X,X,O,O,O,O,X,O,O,T,T,T,O,O, 
iri116	U		16	do you watch any tv series?	
iri117	S		17	what do you ride?	X,X,O,X,X,T,O,O,X,T,T,X,O,X,X,X,X,X,O,X,X,X,X,X,X,X,X,X,T,X, 
iri118	U		18	what do you mean?	
iri119	S		19	when it is him it does not look like him.	X,X,O,X,X,T,T,O,X,O,X,X,O,X,X,X,X,X,X,X,X,X,X,X,X,X,X,X,X,X, 
iri120	U		0	hi alex!	
iri121	S		1	hi. who looks like a carrot?	T,O,T,O,T,X, T,T,O,O,O,T,T, T,O,T,O,T,X,T,T,O,O,O,X,O,T,O,O,O, 
iri122	U		2	i do not know, who does?	
iri123	S		3	him. danny. he is the man with the records.	O,O,O,O,O,T, O,X,O,O,O,O,O, T,O,O,X,X,X,X,T,X,O,O,X,X,T,O,T,O, 
iri124	U		4	why does he look like a carrot?	
iri125	S		5	what does he look like?	O,O,X,O,O,O, O,X,T,T,T,T,T, O,X,T,X,X,X,T,O,O,X,O,T,O,T,O,O,X, 
iri126	U		6	like a carrot	
iri127	S		7	must be my cologne... eau dc carrot.	O,X,X,X,O,T, O,T,O,O,O,O,T, T,X,O,T,X,X,X,T,T,X,T,X,T,T,O,T,X, 
iri128	U		8	that is really funny	
iri129	S		9	--that is not funny--	O,O,T,O,O,T, O,X,T,T,O,T,O, O,O,T,X,X,T,X,T,X,X,O,O,X,T,O,T,X, 
iri130	U		10	i am sorry	
iri131	S		11	oh my god, they killed kenny!	O,X,T,O,T,T, O,X,T,X,T,T,T, T,X,O,T,X,X,X,T,T,X,O,T,X,T,T,X,X, 
iri132	U		12	oh no, poor kenny!	
iri133	S		13	oh you poor dear. you have been through so much...	O,O,O,O,O,O, O,X,O,X,O,T,T, O,O,O,T,X,T,T,T,T,X,O,O,T,T,T,T,T, 
iri134	U		14	i am so so sorry for him	
iri135	S		15	thanks.	O,O,X,O,O,O, O,T,O,O,O,X,T, O,O,O,T,X,X,T,X,X,X,O,T,T,T,T,O,T, 
iri136	U		16	why did they do that? it is so horrible	
iri137	S		17	psychology. they are trying to unnerve us.	O,X,O,O,T,O, O,X,O,O,O,O,T, T,O,O,T,X,X,X,X,T,X,O,T,T,T,X,O,O, 
iri138	U		18	i think they are succeeding	
iri139	S		19	look...	O,X,X,O,O,T, O,X,T,T,T,T,T, O,X,O,X,X,X,X,O,T,X,T,O,O,T,T,O,T, 
iri140	U		0	hey there cutie	
iri141	S		1	that is right. you get her name?	X,O,O,T,O,X,X, X,X,O,O,X,T,O,X,T,X,T,T, O,O,X,X,X,T,X,T,T,X,X, 
iri142	U		2	alex, is not it?	
iri143	S		3	oh, danny, honey. you are so sweet. i could eat you alive...	T,O,T,T,X,T,X, O,X,O,O,T,T,O,O,X,X,T,T, T,T,X,T,X,T,X,X,T,O,X, 
iri144	U		4	i would love to be eaten by you, alex	
iri145	S		5	love to --	O,X,T,O,T,O,O, X,O,O,T,T,O,T,O,O,O,X,T, O,T,X,T,O,O,X,T,T,X,O, 
iri146	U		6	let is	
iri147	S		7	your destination. courtroom six.	X,X,X,X,T,X,X, X,O,O,X,T,T,X,X,X,X,X,X, X,T,X,T,X,T,X,X,X,X,X, 
iri148	U		8	why am i going to a courtroom?	
iri149	S		9	 wouldi am in love again hear my heart strings strumming i am in love again and the hymn they are humming is those cuddle-up huddle-up blues i am in love again and i ca not rise above it.	X,O,X,X,T,X,X, X,O,O,X,X,X,X,O,X,X,X,X, X,X,X,T,X,T,T,X,X,X,X, 
iri150	U		10	that must be the cutest song i have ever heard	
iri151	S		11	so i have heard.	O,T,X,O,O,O,O, X,T,O,T,O,T,O,O,T,O,T,T, T,X,T,T,X,T,T,X,T,O,O, 
iri152	U		12	where did you first hear it?	
iri153	S		13	i do not know. where did you hear that name.	O,O,O,O,O,T,O, T,O,O,X,O,O,O,O,T,O,T,X, O,O,O,T,X,O,T,X,T,X,T, 
iri154	U		14	what name?	
iri155	S		15	well, this is going to sound a little crazy.	T,T,O,O,T,T,X, T,T,O,X,X,T,X,O,O,X,T,X, O,O,X,T,X,T,X,X,T,X,X, 
iri156	U		16	i love crazy	
iri157	S		17	okay, i feel kind of stupid but...	O,O,T,O,T,O,O, O,O,O,T,X,X,T,O,O,O,O,T, O,T,X,T,O,T,T,X,T,O,O, 
iri158	U		18	go ahead, please do not worry	
iri159	S		19	i had the last strawberry in the refrigerator.	X,X,O,T,T,O,X, O,X,O,X,T,X,T,X,O,T,X,X, X,X,X,T,O,T,X,X,X,O,X, 
iri160	U		0	hi alex	
iri161	S		1	what are you doing?	O, O,T,O,O,O,O,O,O,O,O,O,O,O,O,O,O,O,O,O,O,O,O, O,O,O,T,O,X, O, 
iri162	U		2	just came back from lrec	
iri163	S		3	why do they have you tied up here?	O, T,X,X,T,X,O,T,O,O,O,O,O,T,O,O,O,O,T,T,O,O,O, T,O,O,T,O,O, T, 
iri164	U		4	because this is where i work, i have to be here everyday	
iri165	S		5	so this is where you work.	X, O,X,T,O,O,X,T,O,X,T,T,T,T,T,T,X,X,T,T,O,O,O, O,O,O,T,O,O, O, 
iri166	U		6	yeap, what about you, where do you work?	
iri167	S		7	back in the saddle.	X, T,X,X,X,T,X,T,T,X,X,X,X,X,X,X,X,X,X,T,X,O,O, X,O,O,T,O,O, X, 
iri168	U		8	oh, interesting... and what you do there?	
iri169	S		9	is it?	X, X,X,X,X,T,O,X,T,O,O,O,O,X,O,O,O,O,O,X,O,O,T, X,T,T,O,O,O, X, 
iri170	U		10	i do not get it, sorry, still with jetlag, what do you mean?	
iri171	S		11	with your life.	X, X,X,X,X,T,X,X,T,T,T,T,T,X,T,T,T,T,T,T,T,O,T, O,X,X,O,X,X, X, 
iri172	U		12	hmmm, no capito	
iri173	S		13	and your mother was very beautiful. she must be proud of you.	X, X,O,X,X,X,X,T,O,X,X,X,X,X,X,X,X,X,X,X,X,O,X, X,X,T,X,X,X, T, 
iri174	U		14	yes, she is indeed	
iri175	S		15	your name is melville?	X, X,O,X,X,X,O,O,T,O,O,O,O,X,O,O,O,O,T,X,O,O,T, O,T,T,X,X,X, T, 
iri176	U		16	no... i am danny	
iri177	S		17	look, there is danny and her little boyfriend	X, T,O,O,X,O,T,X,T,T,X,T,X,O,X,X,X,X,T,T,X,O,O, X,X,T,X,X,T, X, 
iri178	U		18	i think you are confused	
iri179	S		19	yeah, you know, probably one of these fast-talking career gals...	X, T,T,X,X,X,O,X,T,O,O,O,O,X,O,O,O,O,T,T,X,O,T, X,X,T,X,X,X, T, 
iri180	U		0	hello	
iri181	S		1	mr. president...	O,O, X,O,T,T,O,O, X,O, O,X,X,O,T,T,T,T,O,O,O,T,X,X,O,O,X,T,O,O, 
iri182	U		2	yes that is me	
iri183	S		3	that is more than  wouldyes would -- that is  wouldyou bet. would they kiss.	O,X, X,X,X,X,O,T, X,X, O,X,X,T,X,X,T,T,O,T,O,T,T,X,O,T,X,X,O,T, 
iri184	U		4	how are you doing?	
iri185	S		5	let is go. come on.	T,X, T,T,T,X,X,T, X,X, X,X,X,T,X,X,X,T,T,X,X,X,X,O,T,X,X,X,O,X, 
iri186	U		6	do you have some good music?	
iri187	S		7	one hundred american dollars. cash.	O,X, X,X,X,X,X,X, X,T, X,X,X,T,X,X,X,X,X,T,X,X,T,X,X,O,X,X,T,T, 
iri188	U		8	that is expensive	
iri189	S		9	do not worry...	O,O, T,O,O,X,O,O, O,T, X,X,T,T,O,T,T,T,O,X,O,O,T,X,X,O,O,O,X,O, 
iri190	U		10	i need more money	
iri191	S		11	the heck d wouldya mean? what a you guys got yourself mixed up in?	O,O, T,O,T,X,O,O, O,O, X,X,X,T,T,O,T,O,O,X,T,O,O,X,X,O,T,O,T,O, 
iri192	U		12	i just came out of jail	
iri193	S		13	oh, we are going to jail.	O,O, T,O,O,X,O,T, O,O, X,X,X,T,T,O,T,T,T,X,T,O,X,X,X,X,O,T,O,O, 
iri194	U		14	again?!	
iri195	S		15	i am telling you, she is out of control.	O,O, T,O,T,X,O,T, X,O, X,T,X,T,T,O,T,T,O,X,O,T,T,X,X,X,O,O,X,O, 
iri196	U		16	oh no...	
iri197	S		17	danny -	O,T, T,X,O,X,O,T, X,O, X,X,X,T,T,O,X,X,T,X,O,O,X,X,X,O,T,X,T,T, 
iri198	U		18	i know...	
iri199	S		19	look, we gotta talk.	O,O, T,O,T,X,O,O, O,O, X,X,X,T,O,O,T,O,O,X,O,O,X,O,X,O,O,T,T,T, 
iri200	U		0	how old are you?	
iri201	S		1	i am alright.	O,X,X,X,X,X,X,X,X,X,X,X,O,X,O, X,X,X,X,X,X,X,X,X,T,O,X,X,T,O, 
iri202	U		2	no, how old are you?	
iri203	S		3	old enough. how old are you?	T,O,O,O,X,T,O,O,O,O,X,T,O,T,O, T,X,O,O,T,T,O,X,X,T,O,X,T,O,O, 
iri204	U		4	i am 19	
iri205	S		5	we were!	X,T,T,T,X,X,X,X,X,X,X,X,O,X,O, T,X,X,X,X,X,T,X,X,X,X,X,T,O,O, 
iri206	U		6	how long ago was that?	
iri207	S		7	i have been thinking about getting tattoo. you know...	X,O,O,O,T,X,X,O,T,O,X,T,X,T,T, O,T,T,X,X,T,X,X,X,X,X,X,X,X,T, 
iri208	U		8	oh that is awesome, what do you want to get tattooed?	
iri209	S		9	awesome!	X,X,X,X,X,T,T,X,X,X,X,O,X,O,O, X,O,T,O,X,X,T,X,X,X,X,O,T,T,T, 
iri210	U		10	like the word?	
iri211	S		11	so let is take this great form, this very american tradition of entertainment into the 21st century.	X,T,T,T,X,X,X,X,X,T,X,X,X,X,O, O,X,T,X,X,O,X,X,X,X,X,X,X,X,O, 
iri212	U		12	ok	
iri213	S		13	on your marks...  get set go.	X,O,O,O,O,X,T,X,T,O,X,O,X,T,O, O,O,O,X,X,O,O,X,X,X,O,O,X,X,O, 
iri214	U		14	how do we do this?	
iri215	S		15	how do we know it is him?	T,O,O,O,X,T,X,O,X,O,X,T,X,T,T, T,O,X,X,O,X,T,X,X,X,X,O,T,X,T, 
iri216	U		16	we can ask him?	
iri217	S		17	i am alex.	O,X,T,T,X,X,X,X,X,X,X,O,X,T,O, T,O,T,O,X,X,X,X,X,X,X,O,T,T,X, 
iri218	U		18	hi alex	
iri219	S		19	giver her your tray, danny. you are holding up the line.	X,T,T,X,O,X,X,T,X,T,T,O,X,T,X, O,X,X,O,X,O,X,X,X,X,X,X,T,X,X, 
iri220	U		0	hi alex	
iri221	S		1	well, what about my car?	T,O,O,O,X,X,O,T,O,O,O,X,X,T,X,O,T,O,O,O,O,X,T,X,T,O,X,T,T,O, 
iri222	U		2	which car?	
iri223	S		3	the one that is been following us the last mile and a half.	O,O,O,O,O,O,O,O,O,O,O,X,O,X,X,O,T,T,T,X,T,X,O,O,T,O,O,X,X,X, 
iri224	U		4	lol, i did not notice that. how did you know?	
iri225	S		5	i told you. the face.	T,T,O,T,O,X,O,X,O,O,O,O,O,O,X,O,O,T,T,T,T,X,X,O,T,T,X,T,T,X, 
iri226	U		6	the face of whom?	
iri227	S		7	tomorrow, san francisco!	X,T,O,X,X,X,O,X,O,O,T,X,T,X,X,X,T,T,T,T,T,X,X,X,X,X,X,X,X,X, 
iri228	U		8	ok. sounds great. what is the plan?	
iri229	S		9	what is the plan?	T,T,O,T,X,O,O,T,T,O,T,X,T,T,T,O,T,O,O,O,O,T,X,X,X,T,O,T,T,T, 
iri230	U		10	yes, what do you have in mind?	
iri231	S		11	no, i guess not. i am an actor.	T,T,O,T,X,X,O,X,O,X,T,X,T,X,X,X,O,T,T,T,T,X,X,X,X,X,X,X,X,X, 
iri232	U		12	ok. i can propose to go to the golden gate	
iri233	S		13	you do. you think he is going to propose.	T,O,O,T,X,O,O,T,O,O,T,X,T,X,X,X,T,O,T,T,T,O,X,O,X,O,X,X,X,X, 
iri234	U		14	who is he?	
iri235	S		15	i think i know it, but... i do not remeber now... :)	X,T,O,T,O,T,O,T,O,O,T,X,T,O,X,O,X,T,X,X,X,O,O,X,X,T,T,X,X,X, 
iri236	U		16	ok, never mind. i think we can go later to alcatraz	
iri237	S		17	never mind.	X,T,O,X,O,T,O,X,O,X,T,X,T,O,X,O,X,T,X,X,X,X,O,O,X,T,X,X,X,X, 
iri238	U		18	why? you do not like it?	
iri239	S		19	i am not sure. nervous... i just need a minute in the bathroom.	X,O,O,O,O,T,O,T,O,O,T,X,T,X,X,O,O,T,X,X,X,X,O,X,X,O,X,X,X,X, 
iri240	U		0	hi alex, what is up dude!	
iri241	S		1	danny, you have a call from scottie is teacher. she says it is urgent.	'O','O','T','T','O','T','T','X','T','T','O','X','O','T','O','O', 'O','O','T','O','O','O','O','T', 'T','O','O', 'T','O','O', 
iri242	U		2	what should it be? i finished my homework already	'O','O','X','X','X','X','X','X','X','X','X','X','O','X','O','X', 'T','O','T','O','O','T','O','O', 'T','O','T', 'O','T','T', 
iri243	S		3	i am finished.	'O','O','X','X','X','X','X','X','X','X','X','X','T','X','O','T', 'T','O','T','O','T','X','T','O', 'T','O','X', 'T','T','T', 
iri244	U		4	tell her i am not here	'O','O','X','T','T','T','T','T','T','T','X','X','T','X','O','X', 'T','O','T','O','O','O','X','O', 'X','O','O', 'X','O','O', 
iri245	S		5	i am not.	'O','T','T','T','T','X','T','T','T','T','X','X','T','T','O','T', 'O','O','T','X','O','T','T','T', 'T','O','O', 'O','X','O', 
iri246	U		6	why not, please be a good friend	'O','X','O','O','O','O','O','O','O','O','X','X','T','X','O','X', 'T','O','X','X','O','X','O','X', 'T','O','T', 'X','X','O', 
iri247	S		7	because it was a lie.	'O','T','T','T','T','T','T','T','T','T','T','X','T','X','O','X', 'T','O','X','X','O','T','X','X', 'X','X','O', 'O','O','T', 
iri248	U		8	i see, you are a liar then!	'O','T','O','O','O','O','O','O','O','O','X','O','T','O','O','O', 'T','O','X','X','O','T','X','O', 'X','T','T', 'O','O','O', 
iri249	S		9	0h ali we can work this thing out, you know.	'O','T','O','O','O','O','O','O','O','O','X','T','T','O','O','T', 'T','T','X','X','O','T','T','T', 'X','O','O', 'O','T','O', 
iri250	U		10	aleida, i am not ali...	'O','O','O','O','O','O','O','O','O','O','X','T','T','T','O','T', 'O','O','X','X','O','O','X','O', 'X','O','O', 'O','O','O', 
iri251	S		11	see... wouldkill the body and the head will die would... the frazier/ali fight..	T,X,X,O,O,X,O,O,O,O,O,O,O,X,T,T,T,X,O,O,X,T,T,O,O,T,X,O,X,O, 
iri252	U		12	wow what an important citation!	
iri253	S		13	wow!!	X,X,T,O,O,X,O,O,X,O,O,X,T,T,T,T,X,X,O,X,T,X,T,T,O,T,X,O,O,T, 
iri254	U		14	tell me something	
iri255	S		15	tell me what?	T,X,T,O,O,X,O,O,X,O,O,T,T,X,X,X,X,X,O,O,X,X,X,O,X,T,X,O,X,T, 
iri256	U		16	how many times have you get drunk?	
iri257	S		17	how much have you drunk, danny?	T,X,T,X,O,X,O,O,X,O,T,O,T,X,T,T,X,O,T,O,T,X,X,X,O,T,X,O,O,O, 
iri258	U		18	i asked first...	
iri259	S		19	that is not the issue--	O,O,X,O,X,X,O,O,T,O,T,O,T,O,T,O,X,O,O,T,O,O,T,T,O,O,T,X,X,T, 
iri260	U		0	hello	
iri261	S		1	mr. president...	T,X,T,O,X,X,O,T,X,O,O,X,X,T,T,T,X,O,O,X,O,X,T,O,T,O,X,X,T,O, 
iri262	U		2	no i am not a president. but thanks.	
iri263	S		3	no thanks.	T,X,T,O,X,X,O,O,X,O,T,X,T,T,T,T,X,O,T,T,T,T,X,O,T,T,X,X,O,T, 
iri264	U		4	uh?	
iri265	S		5	i love this plan.	X,O,X,O,X,X,O,X,X,O,T,X,X,T,T,X,X,X,T,O,T,X,O,O,X,T,X,X,O,O, 
iri266	U		6	which plan?	
iri267	S		7	it is working is not it?	T,O,O,O,X,X,O,X,X,O,O,O,X,O,O,O,X,O,T,O,O,O,O,O,O,O,X,X,O,O, 
iri268	U		8	which plan is working?	
iri269	S		9	getting re-elected.	T,X,X,O,X,X,O,X,X,O,X,T,X,T,X,X,X,X,X,O,T,X,T,O,X,T,X,X,X,T, 
iri270	U		10	o that ... i am not sure i want to be re-elected	
iri271	S		11	i am not sure--	O,T,X, T,O,X,T,X,T,T,T,O,X,X,T,T,T,O,T,T,T,T,T,T,T,T,X,T,T,X, 
iri272	U		12	i am sure. i ca not be re-elected. i am not elected yet.	
iri273	S		13	not so fast, pal.	X,T,X, X,X,X,X,X,O,O,O,T,T,X,X,X,T,T,O,O,O,O,O,O,O,O,X,X,X,O, 
iri274	U		14	what?	
iri275	S		15	what did you order?	T,T,X, X,O,O,X,X,T,T,T,X,T,O,X,X,X,X,T,T,T,T,T,T,X,T,X,X,X,X, 
iri276	U		16	wine as usual	
iri277	S		17	more wine?	T,T,X, X,T,X,T,X,X,X,X,T,T,X,X,X,X,X,X,X,X,X,X,X,X,X,T,X,T,X, 
iri278	U		18	no thanks. i would like water now	
iri279	S		19	danny, i want to dance.	X,T,X, X,X,X,X,O,T,T,T,T,T,X,X,X,X,X,T,T,T,T,T,T,T,T,X,T,X,X, 
iri280	U		0	hello alex	
iri281	S		1	yeah... well...	X,X,X, O,X,X,X,X,X,X,X,T,T,X,X,X,X,X,X,X,X,X,X,X,X,X,X,X,X,T, 
iri282	U		2	well...what??	
iri283	S		3	slimeball? louse? jackass?  stuck-up blimpasaurus?	X,T,X, O,X,X,X,O,O,O,O,T,T,X,X,X,X,X,O,O,O,O,O,O,O,O,O,O,T,O, 
iri284	U		4	what you say?	
iri285	S		5	 wouldlittle latin lupe lu. would danny groans.	O,T,X, O,T,X,T,T,X,X,X,T,O,X,X,X,X,X,X,X,X,X,X,X,X,X,O,X,T,X, 
iri286	U		6	i do not get you...	
iri287	S		7	take care, viv.	O,T,X, T,O,X,X,X,O,O,O,T,O,X,X,X,X,X,O,O,O,O,O,O,O,O,X,O,T,O, 
iri288	U		8	oh come on! just tell me something reasonable	
iri289	S		9	oh come on!	T,T,X, T,O,X,T,X,X,X,X,O,T,X,X,X,X,X,X,X,X,X,T,T,X,T,O,T,T,X, 
iri290	U		10	ok, now you are repeating what i am saying...	
iri291	S		11	look, baxter, i am not stupid.	O,O,O,O,T,T,T,T,O,T,O,T,X,T,O,O,O,T,T,O,T,O,T,X,O,O,T,O,O,T, 
iri292	U		12	you shall not pass	
iri293	S		13	why not, against your religion?	O,O,X,X,T,O,O,O,X,O,T,O,O,O,X,X,X,O,O,X,O,O,O,X,O,O,O,O,O,O, 
iri294	U		14	the night is darker before dawn	
iri295	S		15	see you at dawn.	O,T,X,X,X,O,T,T,X,O,X,T,O,O,X,X,X,O,O,X,O,T,T,X,X,X,O,O,O,X, 
iri296	U		16	maybe tomorrow...	
iri297	S		17	you are a big help. can i have one of those?	O,O,T,O,T,O,O,O,O,T,T,X,T,O,O,X,O,T,X,X,X,X,X,X,X,X,T,X,X,X, 
iri298	U		18	are you sure?	
iri299	S		19	you know it.	O,O,T,T,X,O,O,O,T,O,O,O,O,O,T,T,T,O,O,X,O,T,X,X,O,O,O,O,O,O, 
iri300	U		0	heyyyy	
iri301	S		1	what the hell is that?	X,T,T,T,X,T,O,T,T,T,O,X,O,O,T,T,X,T,X,X,T,T,X,X,O,O,T,O,X,O, 
iri302	U		2	it means i am happy to talk to you	
iri303	S		3	ok, thank you for explaining it!	O,X,X,X,X,O,O,T,T,T,T,X,T,T,T,T,T,T,T,T,X,X,X,X,O,O,O,X,O,O, 
iri304	U		4	no problemo	
iri305	S		5	no.	O,X,X,T,X,O,O,O,X,T,T,X,X,O,T,T,X,T,T,X,O,T,X,X,O,O,O,O,T,O, 
iri306	U		6	no?	
iri307	S		7	i have to get her back..	O,X,X,X,X,X,T,X,X,T,T,T,X,O,X,X,X,O,X,X,O,X,X,X,X,X,T,O,X,X, 
iri308	U		8	who?	
iri309	S		9	kubelik.	X,O,O,O,O,T,T,X,O,X,O,T,O,T,O,O,O,T,T,O,T,O,T,X,O,O,X,O,X,X, 
iri310	U		10	who is kubelik?	
iri311	S		11	no kidding. buddy-boy and kubelik having themselves a little toot!	T,X,X,O,X,X, X,T,O,O,O,X,X,O,O,O,T,T,T,X,O,X,T,O,O,X,O,T,O,O, 
iri312	U		12	what does that mean?	
iri313	S		13	you sell to people that ca not stay away from an addiction.	X,X,X,T,X,T, X,T,O,O,X,X,X,O,X,T,O,O,T,T,X,T,T,O,T,X,T,T,T,T, 
iri314	U		14	sell what?	
iri315	S		15	a little of anything that matters.	X,X,X,X,X,X, X,T,O,O,O,X,X,O,T,O,T,T,X,T,X,X,X,O,O,T,X,X,T,X, 
iri316	U		16	drugs?	
iri317	S		17	no, thank you. i am straight.	T,X,X,T,X,X, X,T,O,X,O,X,O,X,O,O,O,O,O,T,T,X,T,O,T,O,O,X,T,T, 
iri318	U		18	are you really straight?	
iri319	S		19	what?	X,X,X,T,O,O, X,X,O,X,O,X,X,X,X,O,O,T,T,X,X,X,X,T,T,T,X,X,T,O, 
iri320	U		0	hi alex, what is new?	
iri321	S		1	that is me <name-self> informal response interactive system !, ha ha ha!	X,X,X,T,X,X, X,X,O,X,O,X,O,X,X,O,O,T,T,X,T,X,T,T,T,X,O,X,O,T, 
iri322	U		2	good for you, i am depressed	
iri323	S		3	i am.	X,X,T,T,O,T, X,X,O,X,O,X,O,X,X,O,O,T,T,X,X,X,X,T,X,X,X,X,T,T, 
iri324	U		4	you too?	
iri325	S		5	see ya.	X,X,O,X,X,T, X,X,T,X,X,X,X,X,X,O,T,T,X,X,X,X,X,T,X,X,T,X,O,T, 
iri326	U		6	i am literally swimming in work!	
iri327	S		7	ha ha.	X,X,T,T,O,X, T,T,T,X,O,X,O,X,X,O,O,T,T,O,X,T,T,T,X,T,T,X,O,T, 
iri328	U		8	that is not funny indeed	
iri329	S		9	do they like chocolate?	T,X,T,T,X,X, X,T,T,X,O,X,O,X,X,O,O,T,T,X,X,X,T,T,X,X,T,X,O,T, 
iri330	U		10	yes, i like it, why?	
iri331	S		11	be careful.	T,O,T,X,T,X,O,T,X,T,X,O,O,X,X,T,T,O,O,T,O,O,O,O,T,T,T,T,T,O, 
iri332	U		12	oh, i see, it has a lot of calories, right	
iri333	S		13	i thought you wanted to get diesel for the summer.	O,O,O,T,O,T,T,O,T,T,X,O,T,X,O,O,O,T,O,T,O,O,O,X,T,O,T,O,O,X, 
iri334	U		14	no, i do not consume diesel	
iri335	S		15	i see a whirlybird!	X,O,O,T,T,X,T,O,T,T,O,O,T,X,O,T,T,T,T,X,O,X,O,X,X,T,O,X,T,X, 
iri336	U		16	what is that?	
iri337	S		17	i think i know it, but... i do not remeber now... :)	O,O,O,O,T,T,T,T,O,O,O,O,O,O,O,X,T,T,O,T,O,T,O,O,X,O,O,X,O,T, 
iri338	U		18	sorry to hear that, it seems you are quite short-minded	
iri339	S		19	something short.	O,X,O,T,T,O,O,T,X,T,X,T,X,T,T,O,T,O,O,X,O,O,X,T,X,O,X,X,T,X, 
iri340	U		0	hi alex	
iri341	S		1	get in.	O,X,O,X,T,X,X,T,X,T,X,T,T,X,T,O,T,T,O,X,O,T,X,O,X,T,O,X,T,X, 
iri342	U		2	no, thanks	
iri343	S		3	i will see you out.	O,X,O,X,T,X,X,T,X,X,X,X,O,T,X,T,T,X,O,X,O,X,O,X,X,O,O,T,O,X, 
iri344	U		4	yes, there is a sunny day out there	
iri345	S		5	in a day or two, yes.	X,X,X,X,T,X,X,X,X,X,X,X,T,X,X,X,X,X,X,X,O,X,O,X,X,X,T,X,X,X, 
iri346	U		6	no, i need to talk to you today!	
iri347	S		7	we need to talk.	X,X,X,X,T,X,X,T,X,T,X,X,X,X,O,T,X,X,O,X,O,T,T,X,X,X,O,X,X,X, 
iri348	U		8	yes, please listen to me	
