id	speaker	time	turn-index	utterance	annotations
iri349	S		9	i do not want to talk about it.	T,X,O,X,T,T,T,O,T,O,X,X,O,O,T,T,T,O,O,X,O,T,T,X,X,X,T,O,X,X, 
iri350	U		10	you do not even know what i am going to say!	
iri351	S		11	yes, you are!	X,X,X,O,O,O, O,T,O,T, O,O,O,O,T,O,T,O,O,T,O,O,O,O,X,O,O, O,X,O, 
iri352	U		12	ok, tell me, what you think i will say?	
iri353	S		13	you notice last night, that tattoo on my butt?	X,T,X,X,O,T, X,O,T,X, T,X,T,X,X,X,X,X,O,X,T,T,T,X,T,T,X, T,X,X, 
iri354	U		14	ha ha ha! very funny	
iri355	S		15	hey head inalexo alexhe school. shane spoalexs somealexhing.	X,X,X,O,T,O, T,T,X,X, T,O,O,X,X,X,T,X,O,X,O,T,O,X,X,O,T, X,X,T, 
iri356	U		16	i want to talk about the number of participants!	
iri357	S		17	well, you are going to have to. your father is at the hospital.	X,T,X,O,O,O, O,T,X,T, X,O,O,O,X,X,X,T,X,X,T,T,O,T,X,O,T, O,O,O, 
iri358	U		18	what happened to him?	
iri359	S		19	well...	X,T,X,O,T,T, T,T,X,X, T,X,T,X,X,X,X,O,X,O,T,X,T,O,X,T,O, X,X,T, 
iri360	U		0	hello alex.	
iri361	S		1	we want you to come with us so we can talk some more about your experiences.	X,T,T,X,T,T, T,T,O,X, X,T,T,X,X,X,X,T,X,T,O,O,T,T,T,X,T, X,X,X, 
iri362	U		2	which experiences exactly?	
iri363	S		3	exactly.	X,O,O,O,T,O, O,T,X,T, T,O,T,O,X,X,X,X,X,X,O,O,T,O,O,O,X, T,O,T, 
iri364	U		4	ok.	
iri365	S		5	i will just wait in the car as you go back e inside to pee. again.	X,X,X,T,T,T, X,T,O,X, X,X,T,X,X,X,T,T,X,O,T,O,T,O,O,X,O, X,X,X, 
iri366	U		6	lol, it is scary how well you know me alex, i do have to pee. again.	
iri367	S		7	scary.	X,T,X,X,T,X, X,O,X,X, X,X,X,X,X,X,X,X,X,X,X,O,X,X,X,X,X, X,X,X, 
iri368	U		8	yup.	
iri369	S		9	wanna hit some of mine?	X,T,O,X,X,X, X,T,X,X, X,T,X,X,X,X,X,T,X,X,X,X,X,X,X,X,X, X,X,X, 
iri370	U		10	some of your what?	
iri371	S		11	dude, i manage an applebee is, that money meant something to me...	T,O,T,O,X,T,O,O,X,O,O,X,O,X,T,O,T,T,X,O,O,T,O,O,O,O,O,T,O,O, 
iri372	U		12	i am pretty sure money means something to everyone.	
iri373	S		13	i  would m sure .	O,X,X,X,X,O,X,X,X,T,O,X,O,T,O,O,O,O,X,X,T,O,X,X,O,X,O,X,X,X, 
iri374	U		14	so which applebee is do you manage?	
iri375	S		15	how do you manage to fit it all in?	O,X,X,X,X,O,X,X,X,T,T,X,T,X,T,X,X,O,X,T,O,X,X,X,X,X,X,T,T,X, 
iri376	U		16	fit what all in?	
iri377	S		17	okay, then... well,  wouldbye...	T,X,X,O,X,X,O,T,X,O,O,X,O,X,O,O,T,X,T,T,X,O,X,X,O,O,O,X,O,T, 
iri378	U		18	aww, are we done talking?	
iri379	S		19	i love it. i feel like a queen.	X,X,O,X,X,O,O,O,O,O,T,O,T,T,O,T,X,O,T,X,O,O,O,X,X,X,X,O,O,T, 
iri380	U		0	hello alex	
iri381	S		1	can i give you my number?	T,X,T,T,X,T,X,X,X,O,O,X,O,O,X,O,T,T,T,O,T,O,T,X,O,O,O,X,T,X, 
iri382	U		2	please	
iri383	S		3	mr bach-templemead...	T,X,T,T,X,X,T,X,O,O,O,X,O,X,O,O,T,X,X,O,T,O,T,X,O,O,O,O,O,T, 
iri384	U		4	ha ha ha	
iri385	S		5	hey head inalexo alexhe school. shane spoalexs somealexhing.	O,X,O,T,X,O,O,O,X,O,X,X,X,O,X,X,O,X,O,T,T,O,O,X,X,X,X,X,O,X, 
iri386	U		6	you are alone there?	
iri387	S		7	i know. i will make sure. how about some breakfast?	O,X,X,T,X,X,X,X,X,T,T,X,T,X,T,X,O,X,T,T,X,T,T,X,X,X,X,O,X,X, 
iri388	U		8	nobody chats with you, let us have the breakfast	
iri389	S		9	you know, danny, you really ought to eat with the rest of us.	O,X,X,X,X,X,X,X,X,T,T,X,X,X,O,X,X,X,T,T,T,T,X,X,X,X,X,X,T,T, 
iri390	U		10	new session	
iri391	S		11	where have you been?	O,T,T,T,T,T,T,T,T,X,X,O,T,O,O, T,O,O,O,T,X, T,X,O, O,X,O, O,T,O, 
iri392	U		12	please	
iri393	S		13	what?	O,O,O,O,O,O,O,O,O,X,O,O,O,O,O, O,O,O,O,T,O, X,O,T, X,O,O, O,T,O, 
iri394	U		14	hello alex	
iri395	S		15	it is me.	T,O,O,O,O,T,T,T,T,X,X,T,O,O,O, T,O,O,O,T,X, X,O,T, T,X,O, O,T,O, 
iri396	U		16	who else is coming for breakfast?	
iri397	S		17	pass.	T,X,X,X,X,X,X,X,X,X,X,T,X,O,O, T,O,O,T,X,T, X,T,O, T,X,X, T,O,T, 
iri398	U		18	what?	
iri399	S		19	danny, get into position.	O,X,X,X,X,X,X,X,T,X,X,T,T,O,T, O,O,X,O,T,T, X,O,O, O,O,O, X,O,T, 
iri400	U		0	hello alex	
iri401	S		1	oh, danny.	T,T,T,T,T,T,T,T,T,X,X,T,T,O,X, X,X,X,T,X,T, X,X,T, X,X,X, X,O,T, 
iri402	U		2	what happened?	
iri403	S		3	are you alright?	O,T,T,T,T,T,T,T,T,O,X,T,X,O,O, T,T,X,O,O,O, X,O,O, O,O,O, X,O,T, 
iri404	U		4	yes, what about you?	
iri405	S		5	is this a secure, uh----	O,X,X,X,X,X,X,X,X,O,X,T,X,T,O, T,T,X,O,O,O, X,O,O, O,O,O, X,O,T, 
iri406	U		6	not sure, so do not say too much	
iri407	S		7	you do too, danny.	T,X,X,X,X,X,X,X,X,X,T,O,X,O,T, T,T,X,O,X,T, X,O,T, X,O,T, X,O,T, 
iri408	U		8	ok, done	
iri409	S		9	you are right. it is ok. i just want it to be ok.	O,O,O,O,O,O,O,O,O,X,O,T,O,O,X, T,T,X,O,X,X, X,O,X, X,O,O, X,O,T, 
iri410	U		10	good for you	
iri411	S		11	three nails.	X,O,O,O,T,X,X,O,X,O,O,X,X,O,O,O,O,O,T,X,X,T,T,X,T,X,O,T,T,X, 
iri412	U		12	only three? you need more?	
iri413	S		13	i need more.	X,T,X,X,X,O,X,T,T,O,T,O,O,X,X,X,O,X,T,X,X,X,X,X,T,X,X,T,X,T, 
iri414	U		14	ok, i can give you seven more nails	
iri415	S		15	ok.	X,O,X,T,X,O,X,T,X,O,T,X,O,T,T,X,X,X,T,X,X,X,X,X,X,X,T,O,X,X, 
iri416	U		16	so you have 10 in total :)	
iri417	S		17	danny, you are a total paranoid.	X,T,O,O,O,O,T,O,X,T,O,X,X,O,O,O,T,T,O,X,X,T,O,T,T,T,O,X,X,T, 
iri418	U		18	ha ha ha you too	
iri419	S		19	why were you buying a coffin?	X,X,X,X,X,O,O,T,T,O,T,X,X,T,X,X,O,O,O,X,X,X,O,X,O,O,X,T,X,O, 
iri420	U		0	hey, how are you today?	
iri421	S		1	syevodnya?	T,O,O,O,O,O,T,O,T,T,O,X,T,O,O,O,T,T,T,X,X,X,O,X,O,O,O,O,X,X, 
iri422	U		2	what?	
iri423	S		3	he sighs with relief.	X,X,O,O,O,T,O,T,T,T,O,T,T,O,O,O,T,T,O,X,O,X,O,T,O,O,O,O,T,O, 
iri424	U		4	that is poetic.	
iri425	S		5	and there is one thing i have learned from being a sports fan.	X,X,T,T,X,O,O,T,T,T,O,T,T,T,T,T,T,X,T,X,T,X,O,T,O,O,T,T,T,X, 
iri426	U		6	what is it?	
iri427	S		7	why do not you ask to somebody else? i am just a robot!	X,X,X,X,X,O,O,X,O,O,T,O,O,X,X,X,O,X,O,X,X,X,O,O,O,O,X,X,X,T, 
iri428	U		8	ok, my bad	
iri429	S		9	it is true, danny.	X,T,O,O,O,O,T,O,O,T,O,X,O,O,O,O,T,T,T,X,X,X,O,X,O,O,O,T,X,O, 
iri430	U		10	i know	
iri431	S		11	then why have you come?	O,T,X,T,T,O,T,O,O,T,O,O,T,T,X,O,X,O,O,O,X,O,T,T,T,T,O,T,T,T, 
iri432	U		12	to help collect data	
iri433	S		13	i am gonna collect someday, you know?	X,T,X,O,X,O,X,X,T,T,T,X,T,X,X,T,T,O,O,T,T,T,X,X,X,X,X,X,T,O, 
iri434	U		14	collect data? on us?	
iri435	S		15	you have no proof that it was correct data.	T,X,T,O,X,O,X,X,O,T,O,T,O,O,T,T,O,O,X,O,O,O,O,O,T,X,X,X,O,O, 
iri436	U		16	but i believe it was	
iri437	S		17	thanks very much.	X,X,X,X,X,X,X,X,T,T,X,X,X,X,O,T,X,X,X,T,X,X,X,X,X,X,X,X,X,T, 
iri438	U		18	i trust you.	
iri439	S		19	how do you know?	O,X,O,O,X,O,X,T,T,T,T,O,X,T,O,O,X,X,X,X,T,X,X,X,T,T,X,X,T,X, 
iri440	U		0	hello you. what is your name?	
iri441	S		1	hello?!	O,X,O,T,X,T,X,T,O,T,O,O,O,T,T,X,T,O,T,T,T,O,O,O,T,X,X,X,X,T, 
iri442	U		2	what is your name ?	
iri443	S		3	mud, if anybody sees you.	X,X,T,T,O,X,T,T,O,T,O,X,O,O,T,X,O,O,O,T,T,O,O,O,O,O,X,T,O,O, 
iri444	U		4	uh ?	
iri445	S		5	have you heard of jonas salk?	T,X,T,T,O,O,X,X,O,T,O,T,O,T,T,O,T,O,T,O,O,O,O,O,X,X,X,X,O,O, 
iri446	U		6	no. never. whos is this	
iri447	S		7	not until sam and jen.	T,X,T,X,X,X,X,T,O,T,O,T,O,T,X,T,X,T,O,T,X,O,O,O,O,O,X,X,X,T, 
iri448	U		8	what do you think about the last star wars?	
iri449	S		9	mallrats, clerks, and dogma.	T,X,T,O,O,O,X,T,O,X,O,T,O,O,O,O,T,T,O,T,T,O,O,O,O,O,X,X,O,O, 
iri450	U		10	what about dogma?	
iri451	S		11	hey...	O,X,X,X,X,X,T,T,X,O,X,T,T,X,X,O,X,X,X,O,X,X,X,X,X,X,T,X,X,O, 
iri452	U		12	do you really want to talk with me?	
iri453	S		13	talk to me.	T,X,T,T,O,O,O,O,O,O,X,O,X,X,O,T,X,X,X,X,X,O,O,T,O,O,X,T,X,T, 
iri454	U		14	yeah. but you say nothing, almost	
iri455	S		15	how are you doing? is cliff here?	T,T,T,T,O,O,O,O,O,O,X,O,X,X,T,O,X,X,X,O,X,X,T,O,T,O,X,T,X,T, 
iri456	U		16	whos is cliff?	
iri457	S		17	so who is the guy?	T,X,X,X,X,X,X,T,O,O,X,X,X,X,T,T,X,X,X,X,X,X,X,X,T,X,X,X,X,T, 
iri458	U		18	i do not know. you tell me	
iri459	S		19	why do not you?	T,X,X,X,X,X,X,T,T,O,X,T,X,X,X,X,X,X,X,X,X,X,X,X,T,X,X,X,X,X, 
iri460	U		0	hi there alex	
iri461	S		1	not him. not him, not him, not him.	T,T,T,X,T,O,X,O,T,O,X,O,X,X,T,O,X,X,X,X,X,O,X,X,T,O,X,T,X,T, 
iri462	U		2	who?	
iri463	S		3	sophie maes. you think she will go out with me?	X,X,X,X,T,X,T,T,T,O,X,O,X,X,X,X,X,X,X,X,O,O,X,T,T,T,X,T,X,T, 
iri464	U		4	sure	
iri465	S		5	you know i need this. you know it will help.	T,T,T,X,O,X,X,T,X,O,X,X,X,X,T,O,X,X,X,X,X,O,O,X,O,X,X,X,X,X, 
iri466	U		6	help with what?	
iri467	S		7	oh! well, what happened to you?	X,T,T,X,X,X,X,T,O,O,X,O,X,X,X,O,X,X,X,X,X,O,X,X,O,T,X,X,X,X, 
iri468	U		8	what do you mean?	
iri469	S		9	yes. okay. yes.	X,T,T,X,O,O,X,T,O,O,X,T,X,X,X,O,X,X,X,X,X,O,X,T,O,X,X,T,X,T, 
iri470	U		10	what?	
iri471	S		11	i have been thinking. maybe we should see other people.	T,O,O,O,O,T,O,T,T,O,T,O,X,O,O,O,O,T,T,O,T,O,O,T,X,O,O,O,T,X, 
iri472	U		12	ok	
iri473	S		13	you notice last night, that tattoo on my butt?	X,O,O,O,O,T,O,O,O,O,O,O,O,O,O,O,O,O,O,T,O,O,O,O,T,O,O,O,T,X, 
iri474	U		14	no	
iri475	S		15	pre lap: the sound of a doorbell...	O,O,O,O,X,O,T,O,T,O,O,O,T,O,O,O,O,T,T,O,O,O,O,O,X,O,O,O,O,X, 
iri476	U		16	huh?	
iri477	S		17	after i did  wouldracula, would the studio offerdanny me  wouldfrankensteing! but i turndanny it down.	O,X,O,O,X,O,T,T,T,O,O,O,O,O,X,O,O,T,O,O,O,T,O,O,O,O,O,O,T,T, 
iri478	U		18	why?	
iri479	S		19	it is not right. i feel horrible. besides...	O,T,O,O,X,X,O,O,O,O,O,O,O,O,X,O,O,O,O,O,O,T,O,O,T,O,O,O,T,T, 
iri480	U		0	hi buddy	
iri481	S		1	what do you want? that is the question, is not it.	T,T,T,O,X,X,T,X,O,O,T,O,T,T,X,O,O,T,O,O,T,X,O,O,T,T,T,O,X,X, 
iri482	U		2	i want to talk to you about the incident	
iri483	S		3	incident?	O,O,T,T,X,T,O,T,T,O,O,O,T,O,X,O,O,T,O,O,T,T,O,T,T,T,O,O,T,T, 
iri484	U		4	yes, you know in trump is last rally	
iri485	S		5	none of the papers covered the rally. not even the sun.	X,X,O,T,X,O,T,T,X,O,O,O,T,T,X,O,T,X,T,X,O,X,O,O,O,T,O,O,T,X, 
iri486	U		6	yes, but it is all over the web!	
iri487	S		7	yes. it is.	X,T,X,X,X,X,T,T,X,X,X,O,X,T,X,T,X,X,T,O,X,X,X,X,T,T,X,O,X,T, 
iri488	U		8	so, what do you plan to do about it	
iri489	S		9	i am gonna go talk to him. you mind staying here?	X,X,T,T,X,O,O,T,X,T,O,O,T,T,X,O,X,T,O,T,T,X,O,X,O,T,T,O,T,T, 
iri490	U		10	sure, i can wait, but let him know he cannot continue with this behaviour in puiblic	
iri491	S		11	i ca not do this. i am telling you, i cannot do this.	O,X,X,T,T,T,X,T,O,T,X,T, X,O,X,O,X,O,X,T,O,T,O,T,T,X, T,X,T,T, 
iri492	U		12	are you scared about talking to him?	
iri493	S		13	what do you think i am talking about?	T,T,T,O,O,O,T,T,O,T,X,T, O,X,O,O,O,X,T,T,T,X,X,O,T,X, O,T,T,O, 
iri494	U		14	to make things clear, this is going out of control. i think this guy is going crazy	
iri495	S		15	this is crazy.	X,X,T,X,X,X,O,X,O,X,X,T, O,X,T,T,O,O,T,X,O,X,O,O,O,X, O,T,O,X, 
iri496	U		16	of course it is	
iri497	S		17	this is the peterson is home.	O,X,X,X,X,X,X,X,X,T,X,T, O,X,X,T,O,X,O,O,T,O,O,O,O,T, T,O,O,T, 
iri498	U		18	whoever home it is, i do not care, just make it right buddy. talk to him!	
iri499	S		19	right? buddy?	X,X,X,O,T,T,X,X,X,X,X,T, X,X,X,T,X,X,T,X,X,X,T,X,X,T, T,X,X,T, 
iri500	U		0	alex, can you tell me a joke?	
iri501	S		1	you are an employee of mr. vitti is.	T,X,X,O,O,O,X,X,X,T,X,T, X,X,X,X,X,X,X,X,X,X,X,X,X,X, T,T,X,O, 
iri502	U		2	who is mr.vitti?	
iri503	S		3	where is vitti? i do not see vitti.	X,O,X,T,T,X,X,T,X,X,X,X, O,X,O,X,O,O,X,T,O,X,X,T,X,X, X,T,X,X, 
iri504	U		4	what is your favorite joke?	
iri505	S		5	that is a joke.	O,X,X,X,X,X,X,T,X,X,X,X, O,X,T,X,O,O,X,X,O,O,T,T,T,X, X,X,O,X, 
iri506	U		6	are you in a relationship right now?	
iri507	S		7	right now.	T,X,X,O,O,O,X,O,X,X,X,X, T,X,O,X,T,X,T,X,X,O,T,X,X,X, T,X,X,T, 
iri508	U		8	with whom?	
iri509	S		9	hello, everyone. matt.  this is danny, whom i told you about.	T,X,X,O,O,O,X,O,X,X,X,X, X,X,X,X,T,O,T,X,T,O,T,T,X,X, X,X,O,X, 
iri510	U		10	who is matt?	
iri511	S		11	yeah. about what?	O,O,O,O,O,O,X,O,O,O,O,O,O,O,O,O,O,O,O,O,X,O,O,O, O,X,T,O,T,O, 
iri512	U		12	what are you doing now?	
iri513	S		13	you said to leave. so i am outtie-	T,X,T,X,O,T,O,T,T,O,T,O,T,X,O,T,O,T,T,O,T,O,O,O, T,X,X,T,O,O, 
iri514	U		14	no do not leave! i love you!	
iri515	S		15	danny is out.	O,O,T,X,O,O,O,O,X,O,X,O,T,X,T,T,O,T,O,O,T,O,O,O, O,X,T,O,X,T, 
iri516	U		16	nooooo	
iri517	S		17	here! it is a fucking boy. anyone got a cigar?	O,T,T,T,X,T,O,O,T,O,X,O,T,X,T,X,O,T,O,O,X,T,T,O, X,X,T,O,T,T, 
iri518	U		18	who is the  wouldfucking boy would?	
iri519	S		19	shut up.  if you have to talk, just be vague. can you do that?	X,X,T,X,O,X,T,T,X,T,X,O,T,X,O,X,T,X,T,O,T,X,X,O, X,T,T,X,X,O, 
iri520	U		0	hi	
iri521	S		1	how is it going?	X,X,X,X,O,X,O,T,T,T,X,O,T,X,T,X,X,X,X,T,X,X,X,O, X,O,T,T,X,T, 
iri522	U		2	bad	
iri523	S		3	is he legit?	X,X,X,O,T,X,X,X,X,O,X,O,T,X,X,X,X,X,X,T,T,X,X,O, O,T,T,X,T,T, 
iri524	U		4	nope	
iri525	S		5	i know you do not want to hear it, trace, but you deserve better.	O,T,O,X,T,O,T,O,O,O,X,O,O,X,O,X,O,T,O,X,X,O,T,O, O,T,X,O,X,T, 
iri526	U		6	i guess so, but i am just so misserable	
iri527	S		7	i guess so.	O,T,O,O,X,O,X,T,O,O,X,O,X,O,O,X,O,T,O,T,T,X,T,O, O,O,T,O,X,T, 
iri528	U		8	this is horrible	
iri529	S		9	ooh, 124! this is me.	O,T,O,O,O,O,T,T,O,O,X,O,O,O,O,X,O,O,O,T,T,O,O,O, O,O,T,O,O,O, 
iri530	U		10	???	
iri531	S		11	to an asian design major.	T,X,X,X,O,O,T,O,O,O,T,X,X,X,X,X,O,T,O,O,T,T,X,O,T,T,O,T,T,X, 
iri532	U		12	what the hell are you talking about?	
iri533	S		13	you bastard! they will never let us back in that place.	X,X,X,X,O,X,X,O,X,O,X,O,X,X,X,X,O,T,O,O,X,T,X,X,O,T,X,T,X,T, 
iri534	U		14	that is why i am feeling so depress	
iri535	S		15	so am i.	O,O,O,O,O,O,T,O,O,O,T,O,O,T,O,O,O,O,O,X,O,T,O,X,O,T,O,X,X,X, 
iri536	U		16	we better forget about it ok	
iri537	S		17	well, maybe we would better forget about it, then.	T,X,X,T,O,O,X,O,X,T,X,T,T,T,X,X,O,T,O,O,X,T,O,X,O,T,O,O,X,T, 
iri538	U		18	yeha, there will be much better places to go in the future for us	
iri539	S		19	what places?	T,O,T,T,X,O,T,O,O,O,X,X,O,X,T,X,O,O,O,O,O,T,O,X,T,T,X,T,T,X, 
iri540	U		0	hello	
iri541	S		1	i forgot my hat.	T,X,O,T,X,T,T,O,O,O,T,T,X,X,T,X,O,X,O,O,T,T,O,X,T,T,X,T,T,T, 
iri542	U		2	where did you forget you hat?	
iri543	S		3	this is my brother-in-law, karl danny.	X,X,O,O,X,T,X,O,T,O,X,T,T,X,T,X,O,X,O,O,T,T,O,O,T,T,O,X,X,X, 
iri544	U		4	nice to meet you karl	
iri545	S		5	thank you very much.	X,X,X,X,X,X,T,O,O,O,X,X,X,X,X,X,O,T,O,O,X,T,X,X,T,T,X,T,T,X, 
iri546	U		6	you are welcome	
iri547	S		7	i got the whole ride programmed.	X,X,X,T,X,T,T,O,O,O,T,T,X,X,T,X,O,O,O,O,O,T,X,X,T,T,X,O,O,O, 
iri548	U		8	i see	
iri549	S		9	no cutting, by the way.	X,X,X,X,X,X,O,T,T,O,X,X,X,X,T,X,O,O,O,O,X,T,O,T,O,T,X,O,T,T, 
iri550	U		10	ok, sure	
iri551	S		11	do not leave this party until you hear from me.	X,T,T,X,X,X,O,X,X,O,X,X,O,X,X,X,X,X,X,O,T,O,X,X,X,X,X,X,T,X, 
iri552	U		12	ok, fine!	
iri553	S		13	i am fine, just keeping packing.	X,X,T,T,X,T,O,X,X,O,O,T,O,X,X,X,X,X,T,O,X,O,X,T,X,X,X,O,X,X, 
iri554	U		14	are you moving out?	
iri555	S		15	he scans the camp. the bird is gone.	O,O,O,O,O,O,O,O,O,O,T,O,O,X,O,O,O,T,O,O,X,O,O,T,X,O,O,O,O,X, 
iri556	U		16	who is scanning the camp?	
iri557	S		17	i think you gotta camp it here...	T,X,T,T,X,X,O,X,X,T,O,T,O,O,T,X,X,X,T,O,O,O,O,X,X,T,X,X,T,X, 
iri558	U		18	i ca not do that!	
iri559	S		19	i tell you, i could fly around this room with my eyes closed!	X,X,T,X,X,X,X,O,T,T,T,O,T,T,X,X,O,X,T,O,T,O,O,T,X,T,O,X,O,X, 
iri560	U		0	where is fire island located ?	
iri561	S		1	goodbye, angels. mr. danny.  ms. wu.	T,T,T,O,X,T,X,O,T,O,T,O,O,T,T,T,O,O,T,O,T,O,O,O,X,O,O,X,O,X, 
iri562	U		2	hello mr. wu	
iri563	S		3	goodbye, angels. mr. danny.  ms. wu.	T,O,O,O,O,T,X,O,O,O,O,O,O,O,T,O,O,T,O,O,T,O,O,O,X,O,O,O,O,X, 
iri564	U		4	nice to meet you	
iri565	S		5	great to meet you nathan. i am a big fan.	T,O,O,O,O,T,X,O,O,T,T,T,T,O,X,O,O,X,O,T,T,O,X,O,X,O,O,X,T,X, 
iri566	U		6	my name is bob	
iri567	S		7	right. and he is playing chronic. aka ray.	X,X,T,X,X,X,X,X,X,T,T,X,T,X,X,X,T,T,X,T,X,T,X,X,X,X,T,X,T,X, 
iri568	U		8	ok , i understand	
iri569	S		9	you notice last night, that tattoo on my butt?	X,X,T,X,X,X,X,X,X,T,T,O,O,X,X,X,X,T,X,T,T,T,X,X,X,T,X,X,T,X, 
iri570	U		10	haha no! i have not noticed it!	
iri571	S		11	seriously, what is going on?	T,O,O,O,T,T,T,O,O,T,X,X,O,O,T,O,O,O,O,T,T,O,O,O,X,O,T,O,X,X, 
iri572	U		12	i am tired !	
iri573	S		13	you can sleep tomorrow... come on...	O,T,O,T,O,O,O,O,X,O,X,X,O,O,O,O,O,O,O,T,T,O,O,O,T,O,X,O,X,X, 
iri574	U		14	no! i want to sleep now	
iri575	S		15	no.	O,X,O,T,T,T,T,X,O,X,T,O,O,O,T,O,O,X,T,X,T,T,X,O,T,O,X,X,X,X, 
iri576	U		16	yes	
iri577	S		17	fucks large women. what can i say.	O,O,O,T,O,T,O,X,T,O,T,O,T,O,T,O,T,X,O,X,T,T,T,O,T,O,X,T,T,T, 
iri578	U		18	i do not get you!	
iri579	S		19	look. they are moving. i told you.	T,X,T,X,T,O,X,X,X,X,O,T,T,T,X,O,X,X,O,X,X,X,X,T,X,X,T,X,T,T, 
iri580	U		0	hi alex	
iri581	S		1	you guys know my roommate, danny.	O,T,T,X,T,X,T,X,T,X,T,T,X,O,X,O,T,X,O,X,X,X,X,O,X,T,T,X,T,T, 
iri582	U		2	hi guys, nice to meet you	
iri583	S		3	nice to meet you.	O,O,O,T,O,O,O,X,T,O,X,T,T,O,T,O,O,X,O,X,O,T,O,O,X,O,X,O,T,T, 
iri584	U		4	by the way, i did not know we where roommates!	
iri585	S		5	you know you did!	O,T,O,X,O,O,O,X,T,O,X,T,T,T,X,O,X,X,T,X,T,T,T,O,T,T,T,X,O,O, 
iri586	U		6	well, i am confused now	
iri587	S		7	are not we all?	O,X,X,T,T,X,T,X,O,X,T,T,T,O,X,O,T,X,O,X,O,X,T,T,T,X,T,T,O,O, 
iri588	U		8	i guess so	
iri589	S		9	michael rocks. very hip.	X,X,O,X,T,X,T,X,T,X,T,X,T,O,X,O,T,X,O,X,T,X,T,T,T,T,T,T,O,O, 
iri590	U		10	yeah... very very very hip	
iri591	S		11	oh, danny! dear!	O,T,O,O,T,O,T, O,O,O,O,O,O,T,X,X,X,X,T, T,T,T,T,X,T,X,T,O,X,O, 
iri592	U		12	are you drunk alex?	
iri593	S		13	well, that goes without saying...	X,O,O,T,O,T,O, O,O,O,T,O,O,T,O,T,O,T,T, X,O,O,T,X,T,O,X,X,X,X, 
iri594	U		14	ver bad, it is so early in the morning and you are drunk already!	
iri595	S		15	drunk.	T,O,T,T,O,X,X, X,X,O,X,X,X,T,X,T,X,O,X, O,T,X,T,O,T,X,X,X,X,X, 
iri596	U		16	you are setting bad example for the children	
iri597	S		17	well... there is my keen fashion sense, for one.	T,O,T,T,T,T,T, X,O,O,X,T,X,O,X,X,T,O,T, O,T,T,T,O,T,X,X,X,O,X, 
iri598	U		18	you should be more responsible	
iri599	S		19	there is another worrier. he is probably all cranked up on speed.	X,T,O,T,T,X,T, T,X,O,X,T,X,O,O,X,X,T,T, O,T,X,T,O,T,T,X,X,X,X, 
iri600	U		0	hi there	
iri601	S		1	excuse me.	X,T,T,T,T,X,X, X,X,O,X,T,X,X,X,X,X,X,X, O,T,X,T,X,T,X,X,X,X,X, 
iri602	U		2	what?	
iri603	S		3	a lens. do you have a lens?	O,O,O,X,T,O,O, O,O,O,X,O,O,X,X,T,X,O,T, O,O,X,T,X,T,T,X,X,O,O, 
iri604	U		4	no	
iri605	S		5	danny, i am sorry. it is the job.	T,O,O,X,O,O,T, O,X,O,X,O,O,O,O,O,T,T,T, T,O,O,T,O,T,O,X,T,O,X, 
iri606	U		6	it is ok	
iri607	S		7	come danny, let is go to daddy is new evil lair.	T,O,O,O,O,T,O, O,X,O,X,T,X,X,X,T,O,O,T, X,O,O,T,X,T,O,X,T,X,X, 
iri608	U		8	ok	
iri609	S		9	hide your laptop here.	O,O,O,O,O,O,O, O,O,O,T,O,O,O,O,O,O,O,O, O,O,T,O,O,O,T,X,O,O,X, 
iri610	U		10	ok	
iri611	S		11	no. i am not fighting anymore.	T,O,T,X,O,T,T,X,T,T,T,T,T,O,O,T,X,X,X,T,T,T,O,T,X,T,T,X,T,T, 
iri612	U		12	ok	
iri613	S		13	could you please say something different?	O,O,X,X,O,X,X,X,O,O,X,X,O,O,T,X,X,T,O,X,X,X,O,O,T,O,X,O,T,T, 
iri614	U		14	yes, sorry	
iri615	S		15	how is the tea?	O,O,O,T,O,O,O,O,O,O,O,T,T,T,O,T,X,O,T,O,O,O,O,O,O,O,X,O,T,O, 
iri616	U		16	it is lovely	
iri617	S		17	what is the matter?	O,O,X,O,T,T,T,T,O,O,T,X,T,X,T,O,X,T,O,T,T,T,X,O,T,X,X,O,T,O, 
iri618	U		18	nothing, i am just a bit stressed	
iri619	S		19	just a little bit?	O,O,X,O,T,X,X,X,O,T,X,O,T,X,T,T,X,X,O,X,X,X,X,X,X,X,X,X,X,O, 
iri620	U		0	hello	
iri621	S		1	yeah... you are kidding.	X,O,T,O,X,T,X,X,O,O,X,X,O,T,O,X,X,X,O,T,T,T,X,T,T,T,X,T,X,T, 
iri622	U		2	about what?	
iri623	S		3	that is your receipt for your husband.  thank you.	X,O,X,O,T,X,X,X,O,O,T,T,O,T,O,O,X,O,T,X,X,X,T,O,T,O,T,O,O,O, 
iri624	U		4	what is the receipt for?	
iri625	S		5	just give me a receipt. hey, danny, you okay?	T,O,O,X,X,O,O,O,O,O,O,T,O,X,O,T,T,O,X,O,O,O,X,T,O,X,X,X,T,X, 
iri626	U		6	yeah, why?	
iri627	S		7	you do not have a passport.	X,O,X,X,X,O,O,T,T,O,O,T,O,T,O,O,X,T,T,O,O,O,T,O,T,O,T,O,X,O, 
iri628	U		8	oh shit	
iri629	S		9	sarah, get security! code red.	X,O,T,O,X,O,O,T,O,O,T,X,T,X,T,X,O,O,T,O,O,O,X,O,X,O,T,O,X,T, 
iri630	U		10	i am so sorry i forgot my passport!	
iri631	S		11	come on, stop being a baby about this. okay, so we back-tracked a tad.	O,T,T,O,O,T,T,X,O,O,O,O,T,T,X,T,O,T,X, X,T,T,T,T,T,T, O,O,T,O, 
iri632	U		12	will everything be okay?	
iri633	S		13	yeah, yeah, everything is fine, but...  .i ca not accept this.	X,X,X,O,T,X,X,O,O,T,T,T,T,X,X,X,X,X,X, X,T,X,X,X,O,X, T,T,X,T, 
iri634	U		14	accept the lack of a passport?	
iri635	S		15	shut up. have you got your passport?	X,T,T,O,T,O,O,T,O,X,T,X,T,X,X,O,X,X,X, X,T,X,X,X,X,T, X,T,T,X, 
iri636	U		16	no...	
iri637	S		17	never?	X,X,X,O,T,X,X,O,O,T,T,T,T,X,X,O,X,X,X, X,X,X,X,X,O,O, X,X,X,X, 
iri638	U		18	it is gone	
iri639	S		19	and with it, all hope.	X,X,X,O,T,X,X,O,X,O,O,O,O,X,X,X,X,X,X, X,X,T,X,X,X,X, O,O,X,O, 
iri640	U		0	hi alex, how was your day?	
iri641	S		1	hi, danny, how --	X,T,T,O,T,X,X,T,X,O,O,O,O,X,X,X,X,X,X, X,X,X,X,X,X,T, O,O,X,O, 
iri642	U		2	my day was ok	
iri643	S		3	hide your laptop here.	T,X,X,O,T,X,O,T,O,O,O,O,T,X,X,X,X,X,X, X,X,X,X,X,O,T, O,O,X,O, 
iri644	U		4	where?	
iri645	S		5	i am here with you.	X,X,X,O,T,X,X,O,X,O,O,O,O,X,X,T,X,X,X, X,T,X,X,X,X,T, O,O,X,O, 
iri646	U		6	yes, but what about the laptop?	
iri647	S		7	no.	X,T,X,O,T,X,X,T,X,T,T,T,T,X,X,X,X,X,X, X,X,X,X,T,O,X, T,T,X,T, 
iri648	U		8	no, what?	
iri649	S		9	and how, oh how, can these death traps be avoided?	T,X,X,X,T,X,X,T,T,O,O,O,T,X,X,X,X,T,X, X,X,X,X,T,X,O, O,O,X,O, 
iri650	U		10	which death traps?	
iri651	S		11	which is?	'O','O','O','O','O','T','O','O','O','X','T','O','T','T','O','O','X','O','O','O','T','T','O','X','O','O','T','O','O','O', 
iri652	U		12	ok. let is talk about other things	'O','O','O','X','X','X','T','O','O','O','X','T','X','O','T','O','O','T','T','O','X','T','O','X','T','T','X','O','O','T', 
iri653	S		13	daddy, are you upset that i am still a virgin?!	'X','O','O','X','X','T','X','O','O','X','X','X','O','T','X','O','X','T','T','T','X','O','O','X','X','O','X','X','X','X', 
iri654	U		14	why are you talking about that?	'X','O','T','X','T','X','X','O','T','T','O','T','O','T','X','X','O','T','X','T','T','X','O','T','O','O','O','T','X','T', 
iri655	S		15	weird? you mean like you hanging out with that homeless, poke?	'O','O','T','X','O','X','O','T','T','X','T','O','X','O','X','X','O','O','T','T','O','T','O','T','O','O','T','X','X','T', 
iri656	U		16	yes, weird.	'X','T','X','X','X','X','X','T','X','X','X','X','X','X','X','X','X','T','X','T','X','X','T','X','X','T','X','O','X','X', 
iri657	S		17	i want my money back!	'O','O','X','X','T','X','T','T','T','O','T','T','T','T','T','X','O','O','T','T','X','T','T','T','X','O','X','O','X','T', 
iri658	U		18	i am not going to give you the money back	'O','O','X','X','O','O','O','T','T','T','O','O','O','O','O','X','O','T','X','T','O','O','T','X','O','T','T','T','X','X', 
iri659	S		19	i am not going to....	'O','O','X','X','O','T','O','T','T','O','O','O','T','O','T','X','O','T','O','T','O','O','T','O','T','O','T','T','X','T', 
iri660	U		0	hi alex	'O','O','X','X','X','X','X','X','T','X','X','X','X','X','X','X','T','T','X','T','T','X','T','T','T','O','X','X','X','X', 
iri661	S		1	bad day, huh?	T,T, O,O,O,X,X,O,X,O,O,O,T,T,X,O,O,X,X,O,X, X,O,T,X,T,T,O,X,T, 
iri662	U		2	no, actually, it was not so bad, at least i answered all my emails	
iri663	S		3	you have not answered my question.	X,X, T,X,T,X,T,X,X,O,X,O,X,X,X,X,O,X,T,T,T, X,X,T,X,X,O,O,X,X, 
iri664	U		4	i think i did	
iri665	S		5	for god is sakes, danny, even freud speaks of a latency period.	X,X, T,T,T,X,X,X,X,O,X,X,X,X,X,X,O,X,X,T,X, X,X,T,X,X,O,O,X,X, 
iri666	U		6	what is a latency period?	
iri667	S		7	well, i never had a latency period. i ca not help it.	X,T, T,O,X,X,T,X,X,X,T,X,X,T,T,T,O,X,T,X,T, O,X,T,X,O,O,X,X,X, 
iri668	U		8	ok, so let us change the topic	
iri669	S		9	yeah, well, that is a topic for another-	T,O, O,T,X,X,T,T,X,X,O,T,X,T,T,T,O,O,T,T,X, T,X,T,X,O,O,X,X,T, 
iri670	U		10	did you see kung fu panda?	
iri671	S		11	well fu-uck you!	X,X, T,O,T,X,T,T,T,X,O,T,T,X,X,X,O,X,X,X,X, T,X,T,T,T,O,X,X,X, 
iri672	U		12	sorry, i did not mean any offence, why you got mad?	
iri673	S		13	you are mad. why are you mad?	T,X, T,T,X,X,X,X,T,X,T,T,X,O,X,X,O,X,X,X,X, X,X,T,X,X,O,X,X,T, 
iri674	U		14	you are the one offensive	
iri675	S		15	well, i do not know if sorry can make up for it.	T,X, O,T,T,X,T,X,X,X,X,T,X,O,X,O,O,X,T,X,X, O,O,T,X,T,O,X,X,O, 
iri676	U		16	yes, you own me an apology because you were rude	
iri677	S		17	look, i owe you an apology...	X,X, X,T,T,O,X,X,X,X,X,T,O,X,X,X,X,X,X,X,X, X,X,X,X,X,T,X,X,X, 
iri678	U		18	thanks, next time moderate your vocabulary	
iri679	S		19	next.	X,X, X,X,X,X,X,X,X,X,T,X,X,O,X,X,O,X,X,X,X, X,X,T,X,X,O,X,X,X, 
iri680	U		0	hi alex, how old are you?	
iri681	S		1	not bad.	X,X,X,T,T,T,X,X,X,X, X,X,X,X,X,T,T,T,T,X,O,X,T,T,T,X,T,T,T,T, 
iri682	U		2	not bad movie?	
iri683	S		3	when you fall in love with your kidnappers.	X,X,T,T,T,O,T,O,X,X, X,X,X,X,X,X,X,X,T,X,O,O,X,X,X,X,X,T,O,X, 
iri684	U		4	kidnapper	
iri685	S		5	cease fire!	O,T,X,X,T,X,T,T,O,X, O,X,T,T,O,X,X,X,T,O,O,X,X,X,T,O,T,X,X,X, 
iri686	U		6	cease fire	
iri687	S		7	you do and i will fire you.	O,T,O,O,O,T,T,O,O,X, X,X,T,O,O,O,O,O,T,O,O,T,T,T,T,O,T,O,O,O, 
iri688	U		8	i will fire you first	
iri689	S		9	fire!	X,T,O,O,O,T,T,X,T,X, X,T,T,X,T,O,O,O,T,O,O,T,X,X,X,X,X,O,O,O, 
iri690	U		10	tell me a joke	
iri691	S		11	yeah, well.	X,X,O,O,O,X,T,X,X,X, X,X,X,X,X,O,O,O,X,X,O,T,X,X,X,X,X,O,O,O, 
iri692	U		12	go ahead	
iri693	S		13	 would...but sid, let me urge you to work closely with the new president, and to keep giving danny industries all your energies -- but not your soul.	X,X,X,T,T,X,T,X,X,X, X,X,X,X,T,X,T,T,X,X,O,T,X,X,X,X,X,T,T,T, 
iri694	U		14	and	
iri695	S		15	and nothing. he is just feeling us out.	X,T,O,O,O,T,O,X,O,X, T,X,X,X,O,O,O,O,T,O,O,O,X,X,X,T,X,O,O,O, 
iri696	U		16	really?	
iri697	S		17	little girl. maybe five years old?	O,O,X,T,X,X,O,X,O,X, O,T,O,X,O,X,X,X,O,O,O,O,X,X,X,X,X,X,X,X, 
